RT @USER2320 : * opens Snapchat * \ so today I was .... \ \ I just hate when .. \ \ lem me tell y'all what just happe .... \ \ my boyfriend .. \ URL218 \u2026	X X PUNCT PUNCT NOUN PROPN PUNCT PUNCT ADV NOUN PRON AUX PUNCT PUNCT PUNCT PRON ADV VERB ADV PUNCT PUNCT PUNCT VERB PRON VERB VERB PRON ADV NOUN PUNCT PUNCT PUNCT PRON NOUN PUNCT PUNCT X PUNCT
#PromoProduct Need Something For the Office ? Choose Branded Merchandise As Corporate Gifts URL1126	NOUN VERB NOUN ADP DET NOUN PUNCT VERB NOUN X ADV X X X
LIMITED EDITION half nudes	NOUN NOUN ADP NOUN
@USER858 block 2C	NOUN NOUN X
LloydsPharmacy : Pharmacist - Attleborough #Pharmacy URL1162	NOUN PUNCT NOUN PUNCT X X X
Whatever song @USER1393 just made me listen to by ariana grande completely snatched me I 'm changed	PROPN NOUN NOUN ADV VERB PRON VERB ADP ADP PROPN NOUN ADV VERB PRON PRON AUX VERB
RT @USER22 : RT & REPLY ! #iHeartAwards #BestFanArmy #5SOSFam URL261	X X PUNCT VERB CCONJ INTJ PUNCT X X X X
Sooooo good to find the London #culinary scene is still as #awesome as ever thank you @USER818 #raresteak URL952	NOUN ADJ PART VERB DET PROPN NOUN NOUN AUX ADV ADP NOUN SCONJ ADV VERB PRON X X X
Helping You Get A Better Understanding About Employment With Simple Tips URL1051	VERB PRON VERB DET ADJ NOUN ADP NOUN ADP NOUN NOUN X
#porn #porn Swipe Hookup - meet sexy ladies for SEX DATING - visit : URL553 URL697	X X X X PUNCT VERB ADJ NOUN ADP NOUN NOUN PUNCT X PUNCT X X
Want to bang me ? URL1254 #ass #butt #orgies #sexygifs URL245	VERB PART VERB PRON PUNCT X X X X X X
best thing ever is definitely when people read your message and do n't reply	ADJ NOUN ADV AUX ADV ADV NOUN VERB PRON NOUN CCONJ AUX PART VERB
\ud83d\udc4c\ud83d\udc83 ( with family at Mie Alfin Pengayoman ) \u2014 URL1300	NOUN PUNCT ADP NOUN ADP PROPN X X PUNCT PUNCT X
RT @USER990 : @USER1815 and yet u chose to make the unarmed victim look like a criminal in this case .. \ud83e\udd14	X X PUNCT NOUN CCONJ ADV PRON NOUN PART VERB DET NOUN NOUN VERB ADP DET NOUN ADP DET NOUN PUNCT SYM
I stay getting mad at old shit I need to stop \ud83d\ude2d	PRON VERB VERB ADJ ADP ADJ NOUN PRON VERB PART VERB SYM
RT @USER2007 : Your heart beats about 100,00 times in one day and 36.5 million times in a year .	X X PUNCT PRON NOUN NOUN ADP NOUN NOUN ADP NUM NOUN CCONJ NOUN NUM NOUN ADP DET NOUN PUNCT
RT @USER311 : Lovable AND Quick Do it yourself VALENTINE 'S Working day Presents | THE SORRY Girls - URL1459	X X PUNCT NOUN CCONJ ADJ AUX PRON PRON NOUN PART VERB NOUN NOUN SYM DET ADJ NOUN PUNCT X
well it s a dream job for many , some in the testing section haha URL694	CCONJ PRON AUX DET NOUN NOUN ADP ADJ PUNCT DET ADP DET NOUN NOUN INTJ X
I hate not getting my way and I hate being told no but I m never told no and I always get my way so I have no complaints \ud83d\ude02	PRON VERB PART VERB PRON NOUN CCONJ PRON VERB AUX VERB DET CCONJ PRON AUX ADV VERB DET CCONJ PRON ADV VERB PRON NOUN ADV PRON VERB DET NOUN SYM
RT @USER1515 : I needa stop sleeping thru like half the day BC I always end up being up all night \ud83d\ude43	X X PUNCT PRON VERB VERB VERB NOUN ADP VERB DET NOUN SCONJ PRON ADV VERB ADP AUX ADP DET NOUN SYM
RT @USER2023 : try this class out let me know what you think URL1547	X X PUNCT VERB PRON NOUN ADP VERB PRON VERB PRON PRON VERB X
RT @USER1520 : Mitch to Raul - I think Nikki ca nt win but Tim can . I think he says he does nt want to win but he does #BBCAN4	X X PUNCT NOUN ADP PROPN PUNCT PRON VERB NOUN AUX PART VERB CCONJ NOUN AUX PUNCT PRON VERB PRON VERB PRON AUX PART VERB PART VERB CCONJ PRON AUX VERB
RT @USER327 : Type of girl I want \ud83d\ude4c\ud83c\udffc URL365	X X PUNCT NOUN ADP NOUN PRON VERB X X
Pain is just a consequence of love	NOUN AUX ADV DET NOUN ADP NOUN
@USER2500 w me in background	NOUN ADP PRON ADP NOUN
@USER1040 cool dude you are \ud83d\ude0e	PROPN ADJ NOUN PRON AUX SYM
RT @USER1864 : Beautiful California Flower Fields You Must Visit This Spring \u25ba URL337 @USER1336 #SanDiego URL218 \u2026	X X PUNCT ADJ PROPN NOUN X PRON AUX VERB DET NOUN X X X X X PUNCT
How to fill baseball 's biggest roster holes : Dozens of free agents remain unsigned , including many household n ... URL1602	ADV PART NOUN NOUN PART ADJ NOUN NOUN PUNCT NOUN ADP ADJ NOUN NOUN NOUN PUNCT VERB ADJ NOUN CCONJ PUNCT X
RT @USER1811 : iTunes US : 64 ( + 2 ) Demi Lovato - Body Say ! Buy or gift here : URL1593	X X PUNCT ADV NOUN PUNCT NOUN PUNCT SYM NUM PUNCT PROPN NOUN PUNCT NOUN VERB PUNCT VERB CCONJ NOUN ADV PUNCT X
Donald Trump Reads The Snake Lyric At Campaign Rally Referring To Immigr ... URL295 via @USER1490	PROPN PROPN VERB DET NOUN NOUN ADP NOUN NOUN NOUN PART NOUN PUNCT X ADP PROPN
RT @USER1980 : Curse on Such TABDEELi And New Pakistan in which Women being Molested , Harassed by their own Hooligans !!! #PTIwomenMolesters	X X PUNCT NOUN ADP ADJ NOUN CCONJ ADJ NOUN ADP DET NOUN AUX NOUN PUNCT VERB ADP PRON ADJ NOUN PUNCT X
RT @USER2312 : Maybe If I Was Harry Styles I Could Swim Across The Atlantic .	X X PUNCT VERB SCONJ PRON AUX PROPN NOUN PRON AUX NOUN NOUN DET NOUN PUNCT
LIVE on #Periscope : YoungBankRoll URL1563	PROPN ADP PROPN PUNCT X X
RT @USER1764 : they just Used winwin	X X PUNCT PRON ADV SYM NOUN
RT @USER2213 : WMUR reporting that Cruz will announce intention to name Fiorina running mate .	X X PUNCT NOUN X PRON PROPN AUX VERB NOUN ADP PROPN NOUN VERB NOUN PUNCT
RT @USER1347 : 10 Thousand Times Faster Swift URL1075	X X PUNCT NUM NUM NOUN NOUN PROPN X
Peter Capaldi Confirms New Doctor Who Companion Has Been Cast : Current Doctor Who Peter Capaldi \u2026 URL857 #drwho #doctorwho	NOUN NOUN NOUN ADJ NOUN PRON NOUN AUX AUX NOUN PUNCT X X PRON X X PUNCT X X X
You can get carried away with your desire to retreat from the ... More for Aries URL531	PRON AUX VERB VERB ADV ADP PRON NOUN PART NOUN ADP DET PUNCT ADJ ADP NOUN X
@USER1431 btw , are you Hispanic ? I 've been meaning to ask !	PROPN INTJ PUNCT AUX PRON NOUN PUNCT PRON AUX AUX VERB PART VERB PUNCT
RT @USER2631 : Wrong number texted me today URL374	X X PUNCT ADJ NOUN NOUN PRON NOUN X
RT @USER382 : Ted Cruz promised people of Texas he 'd lead fight against Obamacare , exploding debt , cronyism & amnesty . Ted Cruz promised , t \u2026	X X PUNCT PROPN PROPN NOUN NOUN ADP PROPN PRON AUX VERB VERB ADP PROPN PUNCT PROPN NOUN PUNCT NOUN CCONJ NOUN PUNCT PROPN PROPN NOUN PUNCT X PUNCT
New goal : become an Olympic pup ! URL1019	ADJ NOUN PUNCT VERB DET NOUN NOUN PUNCT X
RT @USER740 : Donovan Mitchell 's athletic ability is unreal .	X X PUNCT X PROPN PART NOUN NOUN AUX NOUN PUNCT
RT @USER2297 : The only straight I am is a straight up bitch	X X PUNCT DET ADV ADV PRON AUX AUX DET ADJ ADP NOUN
I miss him \ud83d\ude14\ud83d\udc99	PRON VERB PRON NOUN
RT @USER504 : Tfry wild af \ud83d\ude02	X X PUNCT X X NOUN SYM
RT @USER1418 : Yeah getting buckets is important but so is stopping someone from getting them is too . URL722	X X PUNCT INTJ VERB NOUN AUX ADJ CCONJ ADV AUX VERB PRON ADP VERB PRON AUX ADV PUNCT X
RT @USER800 : Gone Viral ! This Mum & 1 Day Old Baby Sea Otter Cuddling Are A Cuteness Overload ! - CLICK --> >>> URL447 URL218 \u2026	X X PUNCT ADV NOUN PUNCT DET NOUN CCONJ NUM NOUN ADJ NOUN X X X AUX DET NOUN NOUN PUNCT PUNCT ADV SYM X X X PUNCT
@USER54 thanks for sharing ---==AdamCSmith==--- , have a great Friday :) ( Want this FREE ? >> URL391 )	PROPN NOUN ADP NOUN NOUN PUNCT VERB DET ADJ NOUN SYM PUNCT VERB PRON ADJ PUNCT PUNCT X PUNCT
RT @USER631 : Most slept on artists of today 23 . ) Joey Purp URL1159	X X PUNCT ADJ NOUN ADP NOUN ADP NOUN NUM PUNCT PUNCT X X X
RT @USER95 : Dear Leaders of the Opposition ! Do nt let Your dislike for PM @USER2286 translate into your support for people who want \u2026	X X PUNCT NOUN NOUN ADP DET NOUN PUNCT AUX PART VERB PRON NOUN ADP NOUN PROPN NOUN ADP PRON NOUN ADP NOUN PRON VERB PUNCT
How TO Get Over Your Ex Fast - URL1395 URL1513	ADV PART VERB ADP PRON PROPN NOUN PUNCT X X
Dierks Bentley Is Having Naked Nightmares About Hosting the ACM Awards - and Everyone Benefits ! URL618	NOUN NOUN AUX ADV NOUN NOUN ADP PROPN DET NOUN NOUN PUNCT CCONJ ADV NOUN PUNCT X
Mad men is got to be the best show of all time . Up there with the greats ( i.e. Sopranos ) if not the ultimate best .	NOUN NOUN AUX VERB PART AUX DET ADJ NOUN ADP DET NOUN PUNCT ADP ADV ADP DET NOUN PUNCT NOUN NOUN PUNCT SCONJ PART DET ADJ ADJ PUNCT
Hot Video ! ' In bed with Kanye ' : Sophie Monk parodies rapper 's ... URL428	ADJ NOUN PUNCT PUNCT ADP NOUN ADP PROPN PUNCT PUNCT X X X NOUN PART PUNCT X
Planning a heist at Game to get a copy of No Man 's Sky instead of waiting a week . I know they have it .	VERB DET NOUN ADP NOUN PART VERB DET NOUN ADP DET NOUN PART NOUN ADV ADP VERB DET NOUN PUNCT PRON VERB PRON VERB PRON PUNCT
Hello from the other side I must 've called a thousand times @USER2316	INTJ ADP DET ADJ NOUN PRON AUX AUX VERB DET NUM NOUN X
RT @USER988 : VIDEO : The @USER584 staged a live sit - in to address gun control measures and gun violence URL869 #NoB \u2026	X X PUNCT NOUN PUNCT DET NOUN NOUN DET ADJ VERB PUNCT ADP ADP NOUN NOUN NOUN NOUN CCONJ NOUN NOUN X X PUNCT
am i the only one that does n\u2019t do anything the whole day but gets depressed when the day ends and sees they did n\u2019t do anything	AUX PRON DET ADJ NUM PRON AUX PART VERB PRON DET ADJ NOUN CCONJ VERB NOUN ADV DET NOUN NOUN CCONJ NOUN PRON AUX PART VERB PRON
A new territory is discovered in The Tribez & Castlez ! Can you unlock it too ? URL965 #android , #androidgames , #gameinsight	DET ADJ NOUN AUX NOUN ADP DET NOUN CCONJ NOUN PUNCT AUX PRON VERB PRON ADV PUNCT X X PUNCT X PUNCT X
@USER2328 I love you in the purest sense	PROPN PRON VERB PRON ADP DET NOUN NOUN
@USER457 A1 ) 1 . Ninja Turtles 2 . Iron Man 3 . Captain America 4 . Patrick 5 . Darth Vader 6 . Spongebob #FlipkartCuriousCases	NOUN NUM PUNCT NUM PUNCT NOUN NOUN NUM PUNCT NOUN NOUN NUM PUNCT PROPN PROPN NUM PUNCT NOUN NUM PUNCT X X NUM PUNCT X X
RT @USER1901 : fucking endless women you do n't care about is n't gon na change the fact that you still love your ex girlfriend my nigga . \u2026	X X PUNCT ADJ NOUN NOUN PRON AUX PART VERB ADP AUX PART VERB PART VERB DET NOUN SCONJ PRON ADV VERB PRON NOUN VERB PRON NOUN PUNCT PUNCT
181 Death and All His Friends #VeranoMTV2016 Coldplay #MTVHottest Coldplay	NOUN NOUN CCONJ DET PRON NOUN SYM PROPN X PROPN
* Tips To Get A Girlfriend Without Spending Too Much Money >> URL557	PUNCT NOUN PART VERB DET NOUN ADP NOUN ADV ADJ NOUN PUNCT X
RT @USER298 : Highest quality tea tree oil on the market . #beauty #health #skincare #teatreeoil URL158 URL137 \u2026	X X PUNCT NOUN NOUN NOUN NOUN NOUN ADP DET NOUN PUNCT X X X X X X PUNCT
Hey , @USER2366 , let 's go on a #DateNight to see @USER1892 . \ud83d\udc91\ud83d\ude02 . I see lots of belly laughs in our future !!! \ud83d\udd2e URL1434	INTJ PUNCT NOUN PUNCT VERB PART VERB ADP DET NOUN PART VERB NOUN PUNCT X PUNCT PRON VERB NOUN ADP NOUN NOUN ADP PRON NOUN PUNCT X X
RT @USER1293 : Glaswegian burds say there 's nuhin sexier than the sound ae a boy rippin aff his velcro trainers	X X PUNCT X X VERB PRON AUX NOUN NOUN ADP DET NOUN NOUN DET NOUN NOUN X PRON NOUN X
Haters gon na hate	NOUN VERB PART VERB
@USER1645 you 've changed a lot jkjk	PROPN PRON AUX VERB DET NOUN NOUN
RT @USER2191 : This Rare Picture Captures Something That Happens In Less Than 1 Out Of 80,000 Births URL1010	X X PUNCT DET NOUN NOUN NOUN X PRON NOUN ADP NOUN ADV NUM ADP ADP NOUN X X
RT @USER1204 : Today is a big day if you are hoping to become a wealthy venture capitalist URL1505 h/t @USER621 URL220 \u2026	X X PUNCT NOUN AUX DET ADJ NOUN SCONJ PRON AUX VERB PART VERB DET NOUN X X X X X X PUNCT
RT @USER918 : It 's still \ud83c\udf40\ud83c\udf40\ud83c\udf40\ud83c\udf40\ud83c\udf40 all day	X X PUNCT PRON AUX ADV VERB DET NOUN
@USER112 please follow me !!	PROPN INTJ VERB PRON PUNCT
RT @USER2423 : every time a white person meets a Muslim at a grocery store they write a dramatic Facebook post about it lol URL1633 \u2026	X X PUNCT DET NOUN DET ADJ NOUN NOUN DET NOUN ADP DET NOUN NOUN PRON VERB DET ADJ PROPN NOUN ADP PRON INTJ X PUNCT
RT @USER2292 : \ud83d\ude02\ud83d\ude02\ud83d\ude02\ud83d\ude02\ud83d\ude02 ladies are enjoying this #SAMenBreakTheInternet	X X PUNCT PROPN NOUN AUX VERB PRON NOUN
Here just swingin URL987	ADV ADV NOUN X
RT @USER2531 : 10 . When Rihanna was getting LIT to her own song while getting a manicure , she was really feeling herself . \ud83d\ude0d\ud83d\ude1c URL224 \u2026	X X PUNCT NUM PUNCT ADV PROPN AUX VERB PROPN ADP PRON ADJ NOUN SCONJ VERB DET NOUN PUNCT PRON AUX ADV VERB PRON PUNCT X X PUNCT
Thanks @USER2372 for the follow ! I really appreciate it ! Looking forward to learning more about you and what you do :-)	NOUN NOUN ADP DET NOUN PUNCT PRON ADV VERB PRON PUNCT VERB ADV PART NOUN ADJ ADP PRON CCONJ PRON PRON VERB SYM
hell naw ... maybe after spring break URL346	NOUN INTJ PUNCT ADV ADP NOUN X X
Looking for a new epilator ? Philips Satin Soft Wet & Dry Epilator now \u00a3 30 ( WAS \u00a3 100 ) from our OFFICIAL @USER1845 shop URL941	VERB ADP DET ADJ NOUN PUNCT X X X X CCONJ NOUN NOUN ADV SYM NUM PUNCT AUX SYM NUM PUNCT ADP PRON NOUN X X X
These guys are just so full of themselves , saying such things . \ Great gesture and confidence booster \ , apparently . URL384	DET NOUN AUX ADV ADV ADJ ADP PRON PUNCT VERB DET NOUN PUNCT PUNCT ADJ NOUN CCONJ NOUN NOUN PUNCT PUNCT NOUN PUNCT X
RT @USER627 : I 'm the most jealous person on the planet . what 's mine is mine , do n't look at it , do n't touch , and do n't even think ab \u2026	X X PUNCT PRON AUX DET ADJ ADJ NOUN ADP DET NOUN PUNCT PRON AUX PRON AUX PRON PUNCT AUX PART VERB ADP PRON PUNCT AUX PART VERB PUNCT CCONJ AUX PART ADV VERB NOUN PUNCT
RT @USER2022 : how I 'm gunna be when I have a family URL1545	X X PUNCT ADV PRON AUX VERB AUX ADV PRON VERB DET NOUN X
RT @USER1518 : Do n't talk bad about the person when things go south bc at one point in time that 's exactly what you wanted .	X X PUNCT AUX PART VERB ADJ ADP DET NOUN ADV NOUN VERB NOUN NOUN ADP NUM NOUN ADP NOUN PRON AUX ADV PRON PRON VERB PUNCT
Ray Wilkins urges Garde to play Villa \u2019s youngsters ; namechecks one particular talent - HITC #avfc URL498	NOUN NOUN VERB NOUN PART VERB PROPN PART NOUN PUNCT NOUN NUM DET NOUN PUNCT X X X
RT @USER52 : Godfather behind the scenes URL1315	X X PUNCT VERB ADP DET NOUN X
Sushi time in 3 , 2 , 1 ...	NOUN NOUN ADP NUM PUNCT NUM PUNCT NUM PUNCT
RT @USER108 : Such a good thing to have on ur phone . Push the button when u feel unsafe and when u let it go if u do nt enter ur pin they \u2026	X X PUNCT VERB DET ADJ NOUN PART VERB ADP PRON NOUN PUNCT VERB DET NOUN ADV PRON VERB NOUN CCONJ ADV PRON VERB PRON VERB SCONJ PRON AUX PART VERB PRON NOUN PRON PUNCT
RT @USER281 : The Eyenimal Cat Video Camera w/ nightvision ! - URL1052	X X PUNCT DET NOUN NOUN NOUN NOUN X NOUN PUNCT PUNCT X
RT @USER1268 : Can you really make $ 64000 / mo just signing people up with a code ? We review Smash Fund URL1371 URL219 \u2026	X X PUNCT AUX PRON ADV VERB SYM NOUN PUNCT NOUN ADV VERB NOUN ADP ADP DET NOUN PUNCT PRON NOUN X X X X PUNCT
RT @USER814 : This shit hilarious \ud83d\ude02\ud83d\ude02 URL1588	X X PUNCT DET NOUN ADJ SYM X
RT @USER983 : #Trump knows how to make his bank coffers \ Great Again \ right ? What a con artist . URL257	X X PUNCT NOUN VERB ADV PART VERB PRON NOUN NOUN PUNCT ADJ NOUN PUNCT ADV PUNCT PRON DET NOUN NOUN PUNCT X
RT @USER1584 : 15 - year - old youth speaker @USER788 ca n't be silenced . URL1526	X X PUNCT NUM PUNCT NOUN PUNCT ADJ NOUN NOUN NOUN AUX PART AUX NOUN PUNCT X
goal with @USER691 URL431	NOUN ADP NOUN X
RT @USER1330 : Gay Nightclub Shooting The Deadliest In History Of America ! The Mixed Reactions To The Horror Will Shock You ! URL221 \u2026	X X PUNCT ADJ NOUN VERB DET NOUN ADP NOUN ADP PROPN PUNCT DET NOUN NOUN ADP DET NOUN AUX VERB PRON PUNCT X PUNCT
Gerime The Menace ... \ud83d\ude05\ud83d\ude05	VERB DET NOUN PUNCT X
RT @USER454 : Make hundreds of dollars / week playing around on Facebook / Twitter ! URL1636 URL1606	X X PUNCT VERB NOUN ADP NOUN PUNCT NOUN VERB ADP ADP PROPN PUNCT PROPN PUNCT X X
#CareerArc #Retail #Job alert : Manager Trainee - Retail Sales | Speedway | #Brimfield , OH URL664 #Jobs #Hiring	DET NOUN X X PUNCT PROPN NOUN PUNCT NOUN NOUN SYM X SYM X PUNCT INTJ X X X
RT @USER756 : @USER424 Very proud to be in top 3 ' Best places to Work ' , fingers crossed for Thursday - great write up #Awards ht \u2026	X X PUNCT NOUN ADJ ADJ PART AUX ADP NOUN NUM PUNCT ADJ NOUN ADP NOUN PUNCT PUNCT NOUN VERB ADP PROPN PUNCT ADJ VERB ADP NOUN X PUNCT
RT @USER2215 : I agree . I do not HATE Muslims . They have NUMEROUS Muslims majority countries where they can go & be happy . URL222 \u2026	X X PUNCT PRON VERB PUNCT PRON AUX PART ADJ NOUN PUNCT PRON VERB NOUN NOUN X X ADV PRON AUX VERB CCONJ AUX ADJ PUNCT X PUNCT
RT @USER1093 : good ideas URL241	X X PUNCT ADJ NOUN X
Dean still needs more recognition though , but elo and g soul are hella good , I love them URL1239	NOUN ADV VERB ADJ NOUN ADV PUNCT CCONJ NOUN CCONJ X NOUN AUX ADV ADJ PUNCT PRON VERB PRON NOUN
RT @USER2159 : a year later and things have n't changed	X X PUNCT DET NOUN ADV CCONJ NOUN AUX PART VERB
Tickets go on sale in 2 minutes and both my parents are upstairs . I 'm not getting tickets .	NOUN VERB ADP NOUN ADP NUM NOUN CCONJ VERB PRON NOUN AUX NOUN PUNCT PRON AUX PART VERB NOUN PUNCT
@USER642 will score more than #Wade next year and be a better 3pt #shooter than Wade ever was #thankswade #enjoyrondo #goheat #MiamiHeat	NOUN AUX VERB ADJ ADP NOUN ADJ NOUN CCONJ AUX DET ADJ NOUN NOUN ADP NOUN ADV AUX ADJ X X X
Such a beautiful day to be \ atropelado \ - by @USER1638	VERB DET ADJ NOUN PART AUX PUNCT NOUN PUNCT PUNCT ADP NOUN
It 's sad that I had to part ways with my bmcc and Zeiss primes as I had to sell it to pay off my first camera FS 100 as it dropped $ 7 k MSRP	PRON AUX ADJ SCONJ PRON VERB ADP NOUN NOUN ADP PRON NOUN CCONJ NOUN NOUN SCONJ PRON VERB PART VERB PRON PART VERB ADP PRON ADJ NOUN NOUN NUM ADP PRON NOUN SYM NUM NUM SYM
Iphone app gemmation prefab unadulterated \u2013 indivisible guests shines eminent the break : IbcLBe	NOUN NOUN NOUN X X PUNCT X X X X DET NOUN PUNCT X
#Boston #Job Treasury Analyst : MA - Boston , The Treasury Analyst will contribute to the day - to - day financial act ... URL1201	ADJ X X X PUNCT NOUN PUNCT PROPN PUNCT DET NOUN NOUN AUX VERB ADP DET NOUN PUNCT ADP PUNCT NOUN NOUN NOUN PUNCT X
RT @USER1130 : I just drove 4 hours to sleep less than six hours and speak tomorrow morning for 2 minutes . LOL ..... I 'm hooked ! #Toastma \u2026	X X PUNCT PRON ADV NOUN NUM NOUN PART VERB ADV ADP NUM NOUN CCONJ VERB NOUN NOUN ADP NUM NOUN PUNCT INTJ PUNCT PRON AUX NOUN PUNCT X PUNCT
@USER14 FOLLOW & RT to #WIN this stunning @USER285 set for your dad this Father 's Day with 4 x @USER7 . Good Luck !	NOUN VERB CCONJ VERB PART VERB DET NOUN NOUN NOUN ADP PRON NOUN DET NOUN PART NOUN ADP NUM SYM NOUN PUNCT ADJ NOUN PUNCT
RT @USER2416 : Me right now URL1352	X X PUNCT PRON ADV ADV X
RT @USER1822 : My #TeenChoice for #ChoiceModel is @USER507 URL1154	X X PUNCT PRON NOUN ADP NOUN AUX X X
Tombstone will always be my favorite movie .	NOUN AUX ADV AUX PRON ADJ NOUN PUNCT
RT @USER2436 : 1606165 093229 || Scheduling for multiple dates / times to twitter with just text	X X PUNCT NOUN X X NOUN ADP ADJ NOUN PUNCT NOUN PART VERB ADP ADV NOUN
RT @USER708 : We are not saved by any work we 've done , but by the grace and mercy of God .	X X PUNCT PRON AUX PART VERB ADP DET NOUN PRON AUX VERB PUNCT CCONJ ADP DET NOUN CCONJ NOUN ADP PROPN PUNCT
RT @USER1217 : my face vs my soul URL1294	X X PUNCT PRON NOUN ADP PRON NOUN X
RT @USER1246 : depression is n't always at 3 am , sometimes it hits you at 3 pm when you 're with friends , halfway through a laugh and suddenly \u2026	X X PUNCT NOUN AUX PART ADV ADP NUM NOUN PUNCT ADV PRON VERB PRON ADP NUM NOUN ADV PRON AUX ADP NOUN PUNCT VERB ADP DET NOUN CCONJ NOUN PUNCT
@USER2454 @USER1797 @USER1687 I ca n't talk the lass at the hair dressers asked me if she wanted me to trim my brows . #theshame	PROPN PROPN PROPN PRON AUX PART VERB DET NOUN ADP DET NOUN NOUN VERB PRON SCONJ PRON VERB PRON PART VERB PRON NOUN PUNCT X
RT @USER251 : Find the cheapest flights by comparing hundreds of airlines and travel sites URL773 URL1515 \u2026	X X PUNCT VERB DET NOUN NOUN ADP PROPN NOUN ADP NOUN CCONJ NOUN X X X PUNCT
@USER611 @USER2175 add me back too	PROPN NOUN VERB PRON ADV ADV
RT @USER1338 : This is exactly how this song makes me feel lol URL1429	X X PUNCT PRON AUX ADV ADV DET NOUN VERB PRON VERB INTJ X
#Earthquake ( #sismo ) M2.7 strikes 21 km E of #Everett ( #Washington ) 5 min ago . More info : URL1512	NOUN PUNCT NOUN PUNCT NOUN VERB NUM NUM PROPN ADP NOUN PUNCT NOUN PUNCT NUM NOUN ADV PUNCT ADJ NOUN PUNCT X
RT @USER374 : Stay in my life and I swear I 'll stay in yours .	X X PUNCT VERB ADP PRON NOUN CCONJ PRON VERB PRON AUX VERB ADP PRON PUNCT
RT @USER2608 : @USER2488 @USER1906 @USER56 sorry for your loss	X X PUNCT X X X INTJ ADP PRON NOUN
RT @USER961 : Before they tip the #ECF tomorrow , we flash back to #TheAssociation during @USER1100 record - setting season ! URL867	X X PUNCT SCONJ PRON VERB DET NOUN NOUN PUNCT PRON VERB ADV ADP NOUN ADP NOUN NOUN PUNCT VERB NOUN PUNCT X
RT @USER2263 : @USER530 Give me strength to walk on Your principles Guru Ji #HumanityAimsOfMSG	X X PUNCT X VERB PRON NOUN PART VERB ADP PRON NOUN X X X
RT @USER1837 : me : i saw on fb you had a baby friend : ya me : how much does he bench friend : what me : [ leans in to his ear ] how much . doe \u2026	X X PUNCT PRON PUNCT PRON VERB ADP PROPN PRON VERB DET NOUN NOUN PUNCT PRON PRON PUNCT ADV ADV AUX PRON VERB NOUN PUNCT PRON PRON PUNCT PUNCT NOUN ADP ADP PRON NOUN PUNCT ADV ADV PUNCT X PUNCT
This is a serious matter \ud83d\udc95\ud83d\udc9a URL335	PRON AUX DET ADJ NOUN NOUN X
Just paid so many bills FML	ADV VERB ADV ADJ NOUN NOUN
sluts gone wild \u2705 URL420 URL1423	NOUN ADV NOUN X X X
Triangulation Peak , OR [ OC ] [ 2400 x 1714 ] URL646 URL752	NOUN NOUN PUNCT PROPN PUNCT NOUN PUNCT PUNCT NOUN SYM X PUNCT X X
How many of y'all can disagree with someone without calling them out of their name	ADV ADJ ADP NOUN AUX VERB ADP PRON ADP VERB PRON ADP ADP PRON NOUN
I liked a @USER1490 video URL1046 GTA 5 ONLINE - HOW TO SAVE BODYGUARD OUTFITS CLOTHING GLITCH ! [ EASY / NEW ] AFTER PATCH	PRON VERB DET PROPN NOUN NOUN X NUM NOUN PUNCT ADV ADP NOUN NOUN X X NOUN PUNCT PUNCT ADJ PUNCT ADJ PUNCT ADP X
Just sent an invitation to all my friends on Facebook to stop playing Candy Crush and : go hug someone they love .	ADV VERB DET NOUN ADP DET PRON NOUN ADP PROPN PART VERB VERB NOUN NOUN CCONJ PUNCT VERB NOUN PRON PRON VERB PUNCT
RT @USER588 : So happy when I 'm with u \u2764\ufe0f	X X PUNCT ADV ADJ ADV PRON AUX ADP PRON SYM
RT @USER612 : the let 's steal tweets squad URL1022	X X PUNCT DET NOUN PART VERB NOUN NOUN X
A GOOD MOM URL1346	DET ADJ NOUN X
RT @USER2034 : Why is school a thing ? \ud83d\ude43\ud83d\udcda	X X PUNCT ADV AUX NOUN DET NOUN PUNCT X
I 'm bout to text you URL291	PRON AUX VERB PART VERB PRON X
RT @USER2244 : @USER366 @USER1171 @USER2596 Do I have a secret twin sister that you see around the place ? Govian ? Are you kiddi \u2026	X X PUNCT X X X AUX PRON VERB DET NOUN NOUN NOUN SCONJ PRON VERB ADP DET NOUN PUNCT X PUNCT AUX PRON NOUN PUNCT
@USER1708 you 're a great friend to have too ! Thank you \ud83d\ude18\u2764\ufe0f	PROPN PRON AUX DET ADJ NOUN PART VERB ADV PUNCT VERB PRON SYM
RT @USER1066 : MY LIFE #growingupwithsiblings URL1004	X X PUNCT PRON NOUN X X
RT @USER222 : #Ukraine does not recognize court verdicts vs #Sentsov #Afanasyev #Kolchenko #Soloshenko convicted in #Russia URL222 \u2026	X X PUNCT NOUN AUX PART VERB NOUN NOUN ADP PROPN X X X X ADP NOUN X PUNCT
RT @USER2125 : Katy Perry Showing she Her Nips And Camel Toe In A Tight Bikini !!! ( 9 pics ) ////// see here <<<< URL590	X X PUNCT X X VERB PRON PRON NOUN CCONJ NOUN NOUN ADP DET NOUN NOUN PUNCT PUNCT NUM NOUN PUNCT X VERB ADV X X
RT @USER221 : . @USER1434 needs to listen to @USER150 & pay its fair share : URL588 #StandUp2Vz #BetterMatters URL220 \u2026	X X PUNCT PUNCT NOUN VERB PART VERB PART NOUN CCONJ VERB PRON ADJ NOUN PUNCT X X X X PUNCT
RT @USER679 : Mood Asf When I 'm High URL652	X X PUNCT X X ADV PRON AUX ADJ NOUN
RT @USER510 : I stalk myself a lot .. Like I 'll go through my own Twitter , Instagram and watch my story way more than I do anyone else lmao \u2026	X X PUNCT PRON VERB PRON DET NOUN PUNCT VERB PRON AUX VERB ADP PRON ADJ PROPN PUNCT PROPN CCONJ VERB PRON NOUN NOUN ADJ SCONJ PRON VERB PRON VERB INTJ PUNCT
In one state , more children homeschool than attend private schools . Why that should n\u2019t shock you . \u2013 \u2026 URL992 #homeschool	ADP NUM NOUN PUNCT ADJ NOUN NOUN ADP NOUN ADJ NOUN PUNCT ADV PRON AUX PART VERB PRON PUNCT PUNCT PUNCT X X
RT @USER832 : Parents , problems , friends , fakes , love , crush , dating , responsibility , drama , heartache , failures , stress , happiness ; It \u2026	X X PUNCT NOUN PUNCT NOUN PUNCT NOUN PUNCT NOUN PUNCT NOUN PUNCT VERB PUNCT VERB PUNCT NOUN PUNCT NOUN PUNCT NOUN PUNCT NOUN PUNCT VERB PUNCT NOUN PUNCT PRON PUNCT
okay i m watching bates motel byE	INTJ PRON AUX VERB NOUN X X
this is what it 's like to be a vegetarian at school #lent URL547	PRON AUX PRON PRON AUX VERB PART AUX DET ADJ ADP NOUN X X
RT @USER469 : Please share . Missing 18year old is a close friend of my neighbour . URL1028	X X PUNCT INTJ VERB PUNCT NOUN NOUN ADJ AUX DET ADJ NOUN ADP PRON NOUN PUNCT X
A panjabi comment on Pakistan Defense : \ We are in war with Abdalis , Ghorids and Ghazavids . We have named our ... URL551	DET NOUN NOUN ADP NOUN NOUN PUNCT PUNCT PRON AUX ADP NOUN ADP NOUN PUNCT NOUN CCONJ NOUN PUNCT PRON VERB VERB PRON PUNCT X
