new unique backpack ! combines vintage with modern ! URL1283 via @USER415	ADJ NOUN NOUN PUNCT X NOUN ADP NOUN PUNCT X ADP X
RT @USER767 : It 's been 3 years since the release of the music video of Burning Desire . URL637	X X PUNCT PRON AUX AUX NUM NOUN ADP DET NOUN ADP DET NOUN NOUN ADP NOUN NOUN PUNCT X
#openfollow for kpopers just retweet	NOUN ADP NOUN ADV VERB
RT @USER526 : empathy 4 Kesha .... the worst . smh smh .. \ud83d\udc94	X X PUNCT NOUN NUM NOUN PUNCT DET ADJ PUNCT INTJ INTJ PUNCT SYM
RT @USER2128 : do n't jump to conclusions . do n't take what the media says at face value . do your own research & stay informed . stop falling \u2026	X X PUNCT AUX PART VERB PART NOUN PUNCT AUX PART VERB PRON DET NOUN VERB ADP NOUN NOUN PUNCT VERB PRON ADJ NOUN CCONJ VERB NOUN PUNCT VERB X PUNCT
RT @USER445 : Spine - Chilling Stories of Real Life Cannibals , Horrible ! URL1310 URL1455	X X PUNCT NOUN PUNCT NOUN NOUN ADP ADJ NOUN NOUN PUNCT NOUN PUNCT X X
I 've entered for a chance to win a copy of @USER1136 on XB1 from @USER1071 thanks to @USER718 ! Enter HERE : URL1617	PRON AUX VERB ADP DET NOUN PART VERB DET NOUN ADP NOUN ADP NOUN ADP PROPN NOUN ADP NOUN PUNCT VERB ADV PUNCT X
Our military is doing everything it can to equip Iraq 's forces so our troop ... #MikeRogers #quotation URL1226	PRON NOUN AUX VERB PRON PRON AUX PART PROPN NOUN PART NOUN ADV PRON NOUN PUNCT X X X
join our book club and learn about a lot of great books URL1049	VERB PRON NOUN NOUN CCONJ VERB ADP DET NOUN ADP ADJ NOUN X
RT @USER2270 : Keep in mind that some things will never make sense , no matter how hard you try to figure it out . Let go , breathe deeply & l \u2026	X X PUNCT NOUN ADP NOUN PRON DET NOUN AUX ADV VERB NOUN PUNCT DET NOUN ADV ADJ PRON VERB PART VERB PRON ADV PUNCT VERB VERB PUNCT X X CCONJ X PUNCT
RT @USER487 : Where is AKMU Where is MADE full album Where is EXIT : X Where is YGGG Saddest ? Where is Minzy ?	X X PUNCT ADV AUX NOUN ADV AUX VERB ADJ NOUN ADV AUX NOUN PUNCT X ADV AUX NOUN NOUN PUNCT ADV AUX NOUN PUNCT
RT @USER2437 : If you have short memory let me inform you after signing COD Benazir made infamous NRO deal with Mushi . \u263a URL224 \u2026	X X PUNCT SCONJ PRON VERB ADJ NOUN VERB PRON VERB PRON ADP VERB NOUN NOUN VERB NOUN NOUN NOUN ADP NOUN PUNCT SYM X PUNCT
RT @USER1218 : @USER265 Blessed Sunday \ud83d\ude0a	X X PUNCT X X NOUN SYM
Just because a nigga f*cks you , Does Not mean he loves you !!	ADV SCONJ DET NOUN NOUN PRON PUNCT AUX PART VERB PRON VERB PRON PUNCT
Get Weather Updates from theweatherchannel 10:56:06	VERB NOUN NOUN ADP NOUN X
\ @USER1771 : Denial has become such a comfort for some that the truth has become an illusion . \	PUNCT NOUN PUNCT NOUN AUX VERB DET DET NOUN ADP DET DET DET NOUN AUX VERB DET NOUN PUNCT PUNCT
\ You should know , that if you come any closer .. I wo n't let you go . \	PUNCT PRON AUX VERB PUNCT PRON SCONJ PRON VERB DET NOUN PUNCT PRON AUX PART VERB PRON VERB PUNCT PUNCT
#NowPlaying Get Another Boyfriend of @USER1659	X VERB DET NOUN ADP NOUN
#baseball Bengie Molina considers retirement after World Series URL87	NOUN NOUN NOUN NOUN NOUN ADP PROPN PROPN NOUN
#championLife RT @USER2393 : Lakers game wo n't start until they get those rings right ? See you at 10:45	NOUN X X PUNCT PROPN NOUN AUX PART VERB SCONJ PRON VERB PRON NOUN ADV PUNCT VERB PRON ADP X
#howcome condoms smell so bad !!!!!!	PROPN NOUN VERB ADV ADJ PUNCT
#nothappy that Adelaide has lost the #rugbysevens	NOUN PRON NOUN AUX VERB DET NOUN
. @USER1012 & I are talking about optics entrepreneurship & \ the Actuality story \ tonight Media Lab E14 - 525 6 p - 8 p for URL51	PUNCT NOUN CCONJ PRON AUX VERB ADP NOUN NOUN CCONJ PUNCT DET NOUN NOUN PUNCT NOUN NOUN NOUN NOUN PUNCT NOUN NUM NOUN PUNCT NUM NOUN ADP NOUN
1 , 2 , 3 , 4 , 5 Teen Titans !	NUM PUNCT NUM PUNCT NUM PUNCT NUM PUNCT NUM NOUN NOUN PUNCT
; idk why ... but ifeel like talkin dirty O_o	PUNCT INTJ ADV PUNCT CCONJ NOUN ADP NOUN ADJ X
@ troy smith is about to finish the rest of the season for the 49ers ... he 's gon na get them a win this week	ADP PROPN PROPN AUX ADP PART VERB DET NOUN ADP DET NOUN ADP DET NOUN PUNCT PRON AUX VERB PART VERB PRON DET VERB DET NOUN
@USER90 NBC is going to have the NYC fireworks on . They are amazing - at least in person they were two years ago .	PROPN NOUN AUX VERB PART VERB DET NOUN NOUN ADP PUNCT PRON AUX ADJ PUNCT ADP ADV ADP NOUN PRON AUX NUM NOUN ADV PUNCT
@USER153 I 'm scoopin Jo right now	PROPN PRON AUX VERB PROPN ADV ADV
@USER272 I 'm from england . Where 's missiuri ?	PROPN PRON AUX ADP NOUN PUNCT ADV PART NOUN PUNCT
@USER288 i did tooo ! this is getting goood . lol	PROPN PRON AUX NOUN PUNCT PRON AUX VERB NOUN PUNCT INTJ
@USER312 well I 'm fuckn amazin .. lol ... tottaly awsome who 's bad now lol	PROPN CCONJ PRON AUX ADJ NOUN PUNCT INTJ PUNCT X X PRON AUX ADJ ADV INTJ
@USER349 I already have sis !!! Girl they hate me !	PROPN PRON ADV VERB NOUN PUNCT NOUN PRON VERB PRON PUNCT
@USER355 yea I was wondering if after they banned the indian we got a new one	PROPN INTJ PRON AUX VERB SCONJ SCONJ PRON VERB DET NOUN PRON VERB DET ADJ NUM
@USER357 :D	NOUN SYM
@USER367 lmbo	NOUN NOUN
@USER403 the one you said you was gon na make . the one i bought everything for and have been waiting for ?	VERB DET NOUN PRON VERB PRON AUX VERB PART VERB PUNCT DET NOUN PRON VERB PRON ADP CCONJ AUX AUX VERB ADP PUNCT
@USER446 how ??!	NOUN ADV NOUN
@USER447 miss yhuuuu !	NOUN VERB NOUN PUNCT
@USER547 that is the most stunning creature I have ever seen	VERB PRON AUX DET ADJ NOUN NOUN PRON VERB ADV VERB
@USER600 Yeah I m goodie just in the lab working ... Wow ! I need to be where you at ! lol let me visit	PROPN INTJ PRON AUX NOUN ADV ADP DET NOUN VERB PUNCT INTJ PUNCT PRON VERB PART AUX ADV PRON ADP PUNCT INTJ VERB PRON X
@USER678 that 's a tight score .	VERB PRON AUX DET NOUN NOUN PUNCT
@USER688 I hear enough talking , just turn round keep walking haha in that part	PROPN PRON VERB ADV VERB PUNCT ADV VERB NOUN VERB VERB INTJ ADP DET NOUN
@USER771 that 's ladybug	VERB PRON AUX NOUN
@USER842 hi , how are you good ? URL142	PROPN INTJ PUNCT ADV AUX PRON ADJ PUNCT X
@USER915 oh nasty perv lol	PROPN INTJ ADJ NOUN INTJ
@USER935 aight leaving my crib in 20 minutes	NOUN NOUN ADP PRON NOUN ADP NUM NOUN
@USER1007 has no sense !!! LOL	NOUN AUX DET NOUN PUNCT INTJ
@USER1022 I had potted shrimp last night . Except someone else ordered it & I could n't work out why we had creme brulee for a starter ...	PROPN PRON VERB NOUN NOUN ADJ NOUN PUNCT X PRON ADV VERB PRON CCONJ PRON AUX PART VERB ADV ADV PRON VERB NOUN NOUN ADP DET NOUN PUNCT
@USER1031 lol you 're lame ;)	PROPN INTJ PRON AUX ADJ SYM
@USER1039 benadryl is your friend lol	PROPN NOUN AUX PRON NOUN INTJ
@USER1074 @USER2632 @USER1318 @USER1108 can i have your email so i can invite you to a sample sale	PROPN PROPN PROPN NOUN AUX PRON VERB PRON NOUN ADV PRON AUX VERB PRON ADP DET NOUN NOUN
@USER1094 * jumps down walking over to you singing * Why do you do what you do to me ? Yea ! Why wo n't you answer me answer me ! Yea !	NOUN PUNCT NOUN ADV VERB ADV ADP PRON VERB PUNCT ADV VERB PRON VERB PRON PRON VERB ADP PRON PUNCT INTJ PUNCT ADV AUX PART PRON VERB PRON VERB PRON PUNCT INTJ PUNCT
@USER1144 right back atcha bro :)	PROPN ADV ADV NOUN NOUN SYM
@USER1163 haha u wish ! Just wait for me to fins a cool name tht has darren + loewe in it lol ( everything sounds bad :( )	PROPN INTJ PRON VERB PUNCT ADV VERB ADP PRON PART VERB DET ADJ NOUN PRON AUX NOUN SYM NOUN ADP PRON INTJ PUNCT PRON VERB ADJ NOUN PUNCT
@USER1255 Not as bent as my finger ! It looks freaky !	NOUN PART ADP NOUN ADP PRON NOUN PUNCT PRON VERB NOUN PUNCT
@USER1286 @USER2183 nigga u quit to	PROPN VERB NOUN PRON VERB ADP
@USER1290 give him my love !	NOUN VERB PRON PRON NOUN PUNCT
@USER1369 @USER2166 Woooooooow	NOUN NOUN X
@USER1381 of course she is lol	NOUN ADP ADV PRON AUX INTJ
@USER1435 ha ! I 'm gon na go with yes	PROPN INTJ PUNCT PRON AUX VERB PART VERB ADP INTJ
@USER1439 I 'M on east coast and their on . do n't know how that works live in CA. ? WITWIAL	PROPN PRON AUX ADP NOUN NOUN CCONJ PRON ADP PUNCT AUX PART VERB ADV PRON VERB VERB ADP NOUN PUNCT X
@USER1480 china	NOUN PROPN
@USER1485 .. hey no shine .. lol jk .. how been bro ?	NOUN PUNCT INTJ DET NOUN PUNCT INTJ INTJ PUNCT ADV AUX NOUN PUNCT
@USER1493 Key and Jjong are together . >.>	NOUN NOUN CCONJ NOUN AUX ADV PUNCT X
@USER1558 yea ik , just for me hahaa	PROPN INTJ NOUN PUNCT ADV ADP PRON NOUN
@USER1602 @USER1512 I uploaded / uploading remaining albums . Muackszx	PROPN VERB PRON VERB PUNCT NOUN ADJ NOUN PUNCT X
@USER1612 He better !! We buy his stuff ! haha	PROPN PRON ADV PUNCT PRON VERB PRON NOUN PUNCT INTJ
@USER1651 with there boycotts and the way they betrayed the country in ww1 they were right in there assessment	NOUN ADP PRON NOUN CCONJ DET NOUN PRON VERB DET NOUN ADP NOUN PRON AUX ADV ADP PRON NOUN
@USER1676 . Have u meet norway yet ?? Lol	NOUN PUNCT VERB PRON VERB NOUN ADV PUNCT INTJ
@USER1696 hey girl you awake ?????? And I did thanks !	PROPN INTJ NOUN PRON NOUN NOUN CCONJ PRON VERB NOUN PUNCT
@USER1733 Thanks for the #FF !	NOUN NOUN ADP DET NOUN PUNCT
@USER1756 nerp ! Wish I could	PROPN NOUN PUNCT VERB PRON AUX
@USER1763 thanks :3	NOUN NOUN X
@USER1773 come bring me lunch !	NOUN VERB VERB PRON NOUN PUNCT
@USER1774 >_> ok	NOUN NOUN INTJ
@USER1820 we got ta test guh ! My teacher said she gne strt takin off points if we late on test dayz ....	PROPN PRON VERB PART NOUN NOUN PUNCT PRON NOUN VERB PRON VERB VERB VERB ADP NOUN SCONJ PRON ADJ ADP NOUN NOUN PUNCT
@USER1969 Go to sleep . lol	NOUN VERB PART VERB PUNCT INTJ
@USER2055 perhaps	NOUN NOUN
@USER2082 I 'm a big fan of yours and admire your work , follow me ? [ /35	PROPN PRON AUX DET ADJ NOUN ADP PRON CCONJ VERB PRON NOUN PUNCT VERB PRON PUNCT PUNCT X
@USER2201 @USER944 they had their fun , we hd ours ! ;) lmaooo	PROPN NOUN PRON VERB PRON NOUN PUNCT PRON VERB NOUN PUNCT SYM INTJ
@USER2243 noo ... Sostar !!!!	NOUN NOUN PUNCT NOUN PUNCT
@USER2257 All my loving I will send to you \u2665	VERB DET PRON VERB PRON AUX VERB ADP PRON SYM
@USER2294 thanks .	PROPN NOUN PUNCT
@USER2337 Talking points ? #RobFord has a new idea to bring to City of Toronto politics : saving money instead of wasting it . #voteto	NOUN VERB NOUN PUNCT NOUN VERB DET ADJ NOUN PART VERB ADP NOUN ADP NOUN NOUN PUNCT VERB NOUN ADV ADP NOUN PRON PUNCT X
@USER2503 Reportedly Testing All - Dorito Taco Shell URL204	NOUN NOUN NOUN DET PUNCT X X X X
@USER2583 I think I thought a ticket the other day - PayPal says Yes , Eventbrite 's never heard of me . Can you confirm success / fail status ?	PROPN PRON VERB PRON VERB DET NOUN DET ADJ NOUN PUNCT X VERB INTJ PUNCT PROPN PART ADV VERB ADP PRON PUNCT AUX PRON VERB NOUN PUNCT NOUN NOUN PUNCT
@USER2589 where are you	NOUN ADV AUX PRON
@USER2626 swag	NOUN NOUN
A woman dat wants me fa me .... dat s all I ask for .	DET NOUN PRON VERB PRON VERB PRON PUNCT PRON AUX DET PRON VERB ADP PUNCT
Amateur Radio \u2013 Hurricane Katrina interview and audio | Survival Kits URL49	ADJ NOUN PUNCT NOUN NOUN NOUN CCONJ NOUN SYM X X X
Ambitious young Italians are quitting their country in droves , leaving power in the hands of an elderly elite . URL111 #tsunami	NOUN ADJ NOUN AUX VERB PRON NOUN ADP NOUN PUNCT VERB NOUN ADP DET NOUN ADP DET NOUN NOUN PUNCT X X
Be ready for anything because anything goes with me . Check out URL79 #match #sex #real	AUX ADJ ADP PRON SCONJ PRON VERB ADP PRON PUNCT VERB ADP NOUN X X X
Bob and Larry are my new best friends at work ! URL197	NOUN CCONJ PROPN AUX PRON ADJ ADJ NOUN ADP NOUN PUNCT X
Check out Cooking How - To : Homemade Frisco Melts on Tales of a midwestern Housewife ! URL15	VERB ADP NOUN ADV PUNCT ADP PUNCT NOUN X X ADP NOUN ADP DET NOUN NOUN PUNCT X
Cut it out joey ... * talkin to myself *	VERB PRON ADP NOUN PUNCT PUNCT NOUN ADP PRON PUNCT
Deputy pulls over FL man , naked teen in backseat ... URL201 #fl #florida #oops #dumb #sex #dui #traffic #news #police	NOUN VERB ADP NOUN NOUN PUNCT ADJ NOUN ADP NOUN PUNCT X X X X X X X X X X
Did I burn down the joint ? I DO N'T THINK SO . I was makin ornaments out of fish hooks .	AUX PRON VERB ADP DET NOUN PUNCT PRON AUX AUX VERB ADV PUNCT PRON AUX VERB NOUN ADP ADP NOUN NOUN PUNCT
Does it feel like Summer to you ? It does in Myrtle Beach , South Carolina it s 85 degrees	AUX PRON VERB ADP NOUN ADP PRON PUNCT PRON VERB ADP NOUN NOUN PUNCT PROPN PROPN PRON AUX NOUN X
Excellent article about Intelligent Management founder Lepore inspired by Jewish philosophy to find business solutions URL48	NOUN NOUN ADP NOUN NOUN PROPN NOUN VERB ADP NOUN NOUN PART VERB NOUN NOUN X
Excited for rough cut screening of @USER2147 tonight . Then season premier of Friday Night Lights at the Man-sion . Yessirr .	NOUN ADP ADJ VERB NOUN ADP NOUN NOUN PUNCT ADV NOUN NOUN ADP PROPN NOUN NOUN ADP DET NOUN PUNCT X PUNCT
Facing difficulties in serving elder family member get assistance from respite care service and live life peacefully . URL88	ADJ NOUN ADP NOUN NOUN NOUN NOUN VERB NOUN ADP NOUN NOUN NOUN CCONJ ADJ NOUN NOUN PUNCT X
Figurative speech #Englishmajors help me out : \ Twenty sails came into the harbor \ is an example of _____________ ? What figurative type ?	NOUN NOUN NOUN VERB PRON ADP PUNCT PUNCT NOUN NOUN VERB ADP DET NOUN PUNCT AUX DET NOUN ADP NOUN PUNCT PRON NOUN NOUN PUNCT
Forgiveness can not be given for those who choose to use Comic Sans in a business web application . #ui #fail	NOUN AUX PART AUX VERB ADP PRON PRON NOUN PART VERB NOUN NOUN ADP DET NOUN NOUN NOUN PUNCT X X
Good Morning	ADJ NOUN
Gothtober #BLANKtober	NOUN NOUN
Great Gizmos Indoor Garden Green Pots ( Green ) \u00a3 13.94 [ SAVE \u00a3 6.05 ] >> URL13 #bargains #deals 10.27.10	ADJ NOUN NOUN NOUN PROPN NOUN PUNCT PROPN PUNCT SYM NOUN PUNCT X SYM NOUN PUNCT PUNCT X X X X
Guess Who \ American Woman \	VERB PRON PUNCT ADJ NOUN PUNCT
Guhhh deeeh you !	PROPN VERB PRON PUNCT
HIGHHHHHH @USER1784 :)	NOUN NOUN SYM
Had Fun , Now I 'm Omw To My Gma House For Her Birthday	PRON NOUN PUNCT ADV PRON AUX VERB ADP PRON NOUN NOUN ADP PRON NOUN
Happy Guys Finish Last - EmpowHER.com URL156 v\u00eda @USER1854	ADJ NOUN NOUN NOUN PUNCT X X X X
Happy Main Event Day ! GL to all who are playing on Day 1A . Action begins at 3 ET .	ADJ NOUN NOUN NOUN PUNCT NOUN ADP DET PRON AUX VERB ADP NOUN NOUN PUNCT X NOUN ADP NUM PROPN PUNCT
Have #PR pros noticed this like #HR pros have ? RT @USER885 : Is HR morphing into PR ? Read and comment : URL39	AUX NOUN NOUN VERB PRON ADP NOUN NOUN VERB PUNCT X X PUNCT AUX NOUN NOUN ADP NOUN PUNCT VERB CCONJ NOUN PUNCT X
Having lunch at lp with 2 great & funny people @USER2359 && @USER2214	ADV NOUN ADP NOUN ADP NUM ADJ CCONJ ADJ NOUN X X X
How to Find And Cultivate Your Passion	ADV PART VERB CCONJ VERB PRON NOUN
I 'd like to take this over , , what I 'm tryin' to say is you should be mine ..	PRON AUX VERB PART VERB PRON ADV PUNCT PUNCT PRON PRON AUX VERB PART VERB AUX PRON AUX AUX PRON PUNCT
I 'm at Mr. Mikes . URL8	PRON AUX ADP NOUN NOUN PUNCT X
I 'm at Scopa ( 109A Plaza St. , Healdsburg Ave. , Healdsburg ) . URL5	PRON AUX ADP NOUN PUNCT NOUN X X PUNCT NOUN NOUN PUNCT NOUN PUNCT PUNCT X
I ai n't cheat I played the hand I dealt !	PRON AUX PART VERB PRON VERB DET NOUN PRON NOUN PUNCT
I am in concurrence ... Lol RT @USER2558 : @USER923 ex then lol	PRON AUX ADP NOUN PUNCT INTJ X X PUNCT X X ADV INTJ
I call my dad and this dude is blasting music . I ca nt understand him and he keeps saying \ what ? \ . Does n't that mean turn down the music ? =_=	PRON VERB PRON NOUN CCONJ DET NOUN AUX NOUN NOUN PUNCT PRON AUX PART VERB PRON CCONJ PRON VERB VERB PUNCT PRON PUNCT PUNCT PUNCT AUX PART PRON VERB VERB ADP DET NOUN PUNCT X
I do n't mean to stay awake at this hour . But that is what the poorest of all network would do you when you try to download !	PRON AUX PART VERB PART VERB NOUN ADP DET NOUN PUNCT CCONJ PRON AUX PRON DET NOUN ADP DET NOUN AUX VERB PRON ADV PRON VERB ADP NOUN PUNCT
I do n't see how a pumpkin patch can be more sincere than this one	PRON AUX PART VERB ADV DET NOUN NOUN AUX AUX ADJ NOUN ADP DET NUM
I do n't want any of these people in my house right now , do n't have anything to talk about , going to bed	PRON AUX PART VERB DET ADP DET NOUN ADP PRON NOUN ADV ADV PUNCT AUX PART VERB PRON PART VERB ADP PUNCT VERB ADP NOUN
I forgot just how good Molson Golden truly is ...... Thanks TIm O	PRON VERB ADV ADV ADJ NOUN NOUN ADV AUX ADJ NOUN X X
I hate how I am sometimes , it really sucks and I over think .	PRON VERB ADV PRON AUX ADV PUNCT PRON ADV NOUN CCONJ PRON ADV VERB PUNCT
I made $ 300 . That is on top of the $ 550 I 've made earlier on this trip . Not bad if I do say so myself .	PRON VERB SYM NUM PUNCT PRON AUX ADP NOUN ADP DET SYM NOUN PRON AUX VERB VERB ADP DET NOUN PUNCT ADV ADJ SCONJ PRON AUX VERB ADV PRON PUNCT
I posted 11 photos on Facebook in the album \ October 26 , 2010 \ URL67	PRON VERB NUM NOUN ADP PROPN ADP DET NOUN PUNCT PROPN NUM PUNCT NUM PUNCT X
I think I do +_O \ you 're sick \ RT @USER878 : Lmao u do n even know what that means RT @USER862 : Lol nawe lol RT	PRON VERB PRON AUX NOUN PUNCT PRON AUX ADJ PUNCT X X PUNCT INTJ PRON VERB CCONJ ADV VERB PRON PRON VERB X X PUNCT INTJ X INTJ X
I think jawn was tryna be smart talk'n bout da baul little do she know I d nt give two shits about none of these Cheyney boy 's .	PRON VERB NOUN AUX VERB AUX ADJ NOUN ADP DET NOUN ADJ AUX PRON VERB PRON VERB PART VERB NUM NOUN ADP NOUN ADP DET NOUN NOUN PART PUNCT
I wan na do something tonight .	PRON VERB PART VERB PRON NOUN PUNCT
I want Brazilian food	PRON VERB VERB NOUN
If you can see only one Darfur documentary this year , I recommend The Devil Came on Horseback . URL2	SCONJ PRON AUX VERB ADV NUM NOUN NOUN DET NOUN PUNCT PRON VERB DET NOUN VERB ADP NOUN PUNCT X
It 's raining !! \ue330\ue04b	PRON AUX VERB PUNCT X
It s the little things that strengthen my tiny wings .	PRON AUX DET ADJ NOUN PRON VERB PRON ADJ NOUN PUNCT
Know the Professionals , Information and facts on Cosmetic Dentist Procedures and Treatments : Anybody unfamiliar ... URL50	VERB DET NOUN PUNCT NOUN CCONJ NOUN ADP NOUN X X CCONJ NOUN PUNCT PRON NOUN PUNCT X
Lol welcome to Twitter @USER2290	INTJ NOUN ADP PROPN X
Lorex LW2003 LIVE snap Video Baby Monitor ( White ) : Get The Lowest Prices On NEW Lorex LW2003 LIVE snap Video Bab ... URL41	ADJ NOUN PROPN NOUN NOUN NOUN NOUN PUNCT ADJ PUNCT PUNCT VERB DET NOUN NOUN ADP ADJ NOUN X PROPN NOUN NOUN NOUN PUNCT X
MATCHES YA FACE SO YOU COOL . RT @USER1964 : @USER127 it s growing but it s at this ugly stage :(	PROPN NOUN NOUN ADV PRON ADJ PUNCT X X PUNCT VERB PRON AUX VERB CCONJ PRON AUX ADP DET ADJ NOUN SYM
Me too , me too , me too RT @USER1524 @USER2374 i hope u come i hope u come i hope u come	PRON ADV PUNCT PRON ADV PUNCT PRON ADV X X X PRON VERB PRON VERB PRON VERB PRON VERB PRON VERB PRON VERB
My book trailer - WORST SINGING EVER ! YAY ! : URL147	PRON NOUN NOUN PUNCT ADJ NOUN NOUN PUNCT X PUNCT PUNCT X
My friends category is odd again -.-	PRON NOUN NOUN AUX ADJ ADV NOUN
New FC Menu Utility 2.0 #apple URL138	ADJ NOUN NOUN X NUM X X
New NC Highway Signs Welcome Motorists To \ Most Military Friendly State \ : New signs going up on the major highways ... URL37	ADJ PROPN NOUN NOUN NOUN NOUN PART PUNCT ADJ NOUN ADJ NOUN PUNCT PUNCT ADJ NOUN VERB ADP ADP DET ADJ NOUN PUNCT X
Noo it s not cuss you have swag andd you wo nt look dumb ! @USER2646 !!	VERB PRON AUX PART VERB PRON AUX NOUN NOUN PRON AUX PART VERB ADJ PUNCT NOUN PUNCT
Northrop Grumman 3Q profit rises , boosts forecast ( AP ) : AP - Defense contractor Northrop Grumman Corp. say ... URL24	PROPN NOUN NOUN NOUN NOUN PUNCT NOUN NOUN PUNCT PROPN PUNCT PUNCT PROPN PUNCT NOUN X X X X VERB PUNCT X
Not too bad for missing two labs before that !	ADV ADV ADJ ADP NOUN NUM NOUN ADP PRON PUNCT
On eve of UFC debut , James Toney learned of IRS lien , fight purse withheld URL177	ADP NOUN ADP NOUN NOUN PUNCT PROPN PROPN VERB ADP PROPN NOUN PUNCT VERB X X X
Oo yeaa ii hear thunda ! Rainnn kum onnnnnn	PROPN NOUN AUX VERB NOUN PUNCT X X X
Pain is pleasure	NOUN AUX NOUN
People in school thought my shoes were so sick today . alala . Robert wanted to take them :)) and Jack and Craig tried to wear it . fun day .	NOUN ADP NOUN VERB PRON NOUN AUX ADV ADJ NOUN PUNCT X PUNCT X VERB PART VERB PRON NOUN CCONJ PROPN CCONJ PROPN VERB PART VERB PRON PUNCT NOUN NOUN PUNCT
Phoooonneeeeeeeeee with my wife !	VERB ADP PRON NOUN PUNCT
Pretty simple actually . - The DataContext will tunnel down to controls below it in the tree . - The ListBox ... URL31 #WPF #2010	ADV ADJ ADV PUNCT PUNCT DET NOUN AUX VERB ADV PART NOUN ADP PRON ADP DET NOUN PUNCT PUNCT DET NOUN PUNCT X X X
Public and private jobs | Angry Bear : The wife and I used to work retail for the California State Parks . If our pa ... URL18	NOUN CCONJ ADJ NOUN SYM X X PUNCT DET NOUN CCONJ PRON VERB PART VERB ADJ ADP DET PROPN PROPN PROPN PUNCT SCONJ PRON NOUN PUNCT X
Q : So , if I may ask , how would we \ meet u ... A : Lol . I have no clue and yes I would , i ... : URL210	NOUN PUNCT ADV PUNCT SCONJ PRON AUX VERB PUNCT ADV AUX PRON PUNCT VERB PRON PUNCT DET PUNCT INTJ PUNCT PRON VERB DET NOUN CCONJ INTJ PRON AUX PUNCT PRON PUNCT PUNCT X
RT @USER93 : @USER1691 @USER1809 @USER2600 @USER2628 Chck out I CAN RAP ! URL216 & the TAKEOVER ! URL214 ...	X X PUNCT X X X X X ADP PRON AUX NOUN PUNCT NOUN CCONJ DET NOUN PUNCT X PUNCT
RT @USER237 : d-town !	X X PUNCT NOUN PUNCT
RT @USER243 : Bruno Mars hates it when cameramen zoom in too close . #CelebsFacts	X X PUNCT PROPN PROPN VERB PRON ADV NOUN NOUN ADP ADV ADJ PUNCT X
RT @USER337 : I just missed the best twitpic opportunity smh .. This nigga was bald all over but had a pony tail of dreads lol <- \ue40b\ue107\ue107\ue107	X X PUNCT PRON ADV VERB DET ADJ NOUN NOUN INTJ PUNCT DET NOUN AUX VERB DET ADV CCONJ VERB DET NOUN NOUN ADP NOUN INTJ X X
RT @USER410 : Staring at a hot guy and thinking ... We are going to make beautiful babies .	X X PUNCT NOUN ADP DET ADJ NOUN CCONJ VERB PUNCT PRON AUX VERB PART VERB ADJ NOUN PUNCT
RT @USER465 : Damn , when u hit your toe on the door you wan na say every cuss word you know	X X PUNCT INTJ PUNCT ADV PRON VERB PRON NOUN ADP DET NOUN PRON VERB PART VERB DET NOUN NOUN PRON VERB
RT @USER521 : \ Do what you can , with what you have , where you are . \ - Theodore Roosevelt	X X PUNCT PUNCT AUX PRON PRON AUX PUNCT ADP PRON PRON VERB PUNCT ADV PRON VERB PUNCT PUNCT PUNCT X X
RT @USER887 : when in a relationship You need to understand the other person feelings besides yours .	X X PUNCT ADV ADP DET NOUN PRON VERB PART VERB DET ADJ NOUN NOUN NOUN PRON PUNCT
RT @USER951 : Just seen one of my favorite people @USER1297 ... I love her I swear . Muah ! ** awwyyy ! Me heart yu 4x more loveeee !	X X PUNCT ADV VERB NUM ADP PRON NOUN NOUN NOUN PUNCT PRON VERB PRON PRON VERB PUNCT NOUN PUNCT PUNCT NOUN PUNCT PRON NOUN PRON VERB ADV NOUN PUNCT
RT @USER1119 : I wish someone would have told me that it 's okay to cry over nothing and everything for a little while . #HuggiesMom	X X PUNCT PRON VERB PRON AUX VERB VERB PRON SCONJ PRON AUX ADJ PART VERB ADP PRON CCONJ PRON ADP DET ADJ NOUN PUNCT X
RT @USER1135 : Billionaires / CEOs throwing massive $$$ into front Orgs since Citizens United . They plan to BUY America Gov't in 201 ...	X X PUNCT NOUN PUNCT VERB VERB ADJ NOUN ADP NOUN NOUN ADP PROPN PROPN PUNCT PRON VERB ADP VERB PROPN NOUN ADP NOUN PUNCT
RT @USER1191 : I never bought candy bars from those kids on my doorstep so I guess they \u2019re all in gangs now .	X X PUNCT PRON ADV PRON NOUN NOUN ADP PRON NOUN ADP PRON NOUN ADV PRON VERB PRON VERB DET ADP NOUN ADV PUNCT
RT @USER1226 : @USER1642 lol you know i m down like 4 flats on a cadillac ... lol wut it do ?? || Haha ! love it	X X PUNCT PROPN INTJ PRON VERB PRON AUX ADV ADP NUM NOUN ADP DET NOUN PUNCT INTJ X PRON VERB PUNCT PROPN INTJ PUNCT VERB PRON
RT @USER1233 : Eat that pussc like cold pizza lol	X X PUNCT VERB PRON NOUN ADP ADJ NOUN INTJ
RT @USER1388 : I rather watch water boil ......	X X PUNCT PRON VERB VERB NOUN NOUN X
RT @USER1438 : #Quote of the day : \ Fear is just as contagious as courage . Your choice . \	X X PUNCT NOUN ADP DET NOUN PUNCT PUNCT NOUN AUX ADV ADP NOUN ADP NOUN PUNCT PRON NOUN PUNCT PUNCT
RT @USER1497 : You aint sh*t .	X X PUNCT PRON AUX NOUN PUNCT
RT @USER1583 : you do nt know shit , about shit	X X PUNCT PRON AUX PART VERB NOUN PUNCT ADP NOUN
RT @USER1594 : #nsnweekend how can people choose there favourite performance , the whole thing was perfect !	X X PUNCT NOUN ADV AUX NOUN NOUN PRON ADJ NOUN PUNCT DET ADJ NOUN AUX ADJ PUNCT
RT @USER1818 : Home Opener is 2 days away . Need a costume ? 1st 5000 fans get a Halloween black & orange @USER146 yth jersey URL0 ...	X X PUNCT NOUN NOUN AUX NUM NOUN ADV PUNCT VERB DET NOUN PUNCT ADJ NOUN NOUN VERB DET NOUN ADJ CCONJ NOUN X X X X PUNCT
RT @USER1826 : Tonight I 'm at Club West in San Antonio ... This is what it was like the last time I was there . ( cont ) URL182	X X PUNCT X PRON AUX ADP NOUN NOUN ADP PROPN NOUN PUNCT PRON AUX PRON PRON AUX ADP DET ADJ NOUN PRON AUX ADV PUNCT PUNCT NOUN PUNCT X
RT @USER1992 : When life gives you a hundred reasons to cry , stay strong ! Show life that you have a thousand reasons to smile . - Unknown	X X PUNCT ADV NOUN VERB PRON DET NOUN NOUN PART VERB PUNCT VERB ADJ PUNCT NOUN NOUN SCONJ PRON VERB DET NOUN NOUN ADP VERB PUNCT PUNCT X
RT @USER2314 : Seeing warped tour ads everywhere makes me want to cry . My favorite bands are having signings and it s killing me alfhak	X X PUNCT X X NOUN NOUN ADV VERB PRON VERB PART VERB PUNCT PRON NOUN NOUN AUX VERB NOUN CCONJ PRON AUX VERB PRON X
RT @USER2484 : \ Daddy , what are THESE ? Can I have one ? These . Are . AWESOME !! \ Louis , 9 , finding a VHS .	X X PUNCT PUNCT NOUN PUNCT PRON AUX PRON PUNCT AUX PRON VERB NUM PUNCT DET PUNCT VERB PUNCT NOUN PUNCT PUNCT PROPN PUNCT NUM PUNCT VERB DET NOUN PUNCT
Say Anything with boyfriend . :))	VERB NOUN ADP NOUN PUNCT X
