RT @USER852 : New patch will be live tomorrow ! We will live stream during #weekend with #giveaway codes ! check out the #indiegame URL221 \u2026	X X PUNCT ADJ NOUN AUX AUX ADJ NOUN PUNCT PRON AUX VERB NOUN ADP NOUN ADP NOUN NOUN PUNCT VERB ADP DET NOUN X PUNCT
RT @USER65 : I want Wayne Gooney 2 come back on twitter & tell me all the players Wenger is going to sign again ... I miss him terribly # \u2026	X X PUNCT PRON VERB PROPN NOUN NUM VERB ADV ADP PROPN CCONJ VERB PRON DET DET NOUN PROPN AUX VERB PART VERB ADV PUNCT PRON VERB PRON NOUN NOUN PUNCT
RT @USER101 : The Walk - Falling Leaves - Vincent van Gogh , 1889 URL1212	X X PUNCT DET NOUN PUNCT VERB NOUN PUNCT X PROPN X PUNCT X X
Almost as beautiful as you are conceited , she thought at him , and he laughed out loud .	NOUN ADP ADJ SCONJ PRON AUX NOUN PUNCT PRON VERB ADP PRON PUNCT CCONJ PRON VERB ADP NOUN PUNCT
Spend 80 on a watch she call me Dada	VERB NUM ADP DET NOUN PRON VERB PRON X
Stolen Christopher Columbus Letter Returned to Italy - Discovery News : Discovery NewsStolen Christopher Colum ... URL274	NOUN NOUN PROPN PROPN NOUN ADP NOUN PUNCT NOUN NOUN PUNCT X X X X PUNCT X
RT @USER1470 : Lord , lead me so I can lead others .	X X PUNCT PROPN PUNCT VERB PRON ADV PRON AUX VERB NOUN PUNCT
RT @USER1436 : Him : Can you be serious for a moment Me : URL737	X X PUNCT NOUN PUNCT AUX PRON AUX ADJ ADP DET NOUN PRON PUNCT X
@USER171 @USER1134 do you realize that if Jimmy G gets hurt all they have left is Brissett ? Are they really not signing a veteran ?	PROPN NOUN AUX PRON VERB PRON SCONJ NOUN PROPN VERB VERB DET PRON VERB ADJ AUX NOUN PUNCT AUX PRON ADV PART VERB DET NOUN PUNCT
@USER77 \ud83d\ude4f\ud83c\udffb thank god	PROPN PROPN VERB NOUN
Return all the money you stole from Kofi Amoabeng \u2019s drawer \u2013 Diamond \u2018 slaps \u2019 Mzbel URL1379 URL1325	VERB DET DET NOUN PRON VERB ADP PROPN X PART NOUN PUNCT PROPN PUNCT X PUNCT X X X
RT @USER1020 : I hate saying this but uhh \ I still love you \ .	X X PUNCT PRON VERB VERB PRON CCONJ NOUN PUNCT PRON ADV VERB PRON PUNCT PUNCT
RT @USER1072 : Come to the dark side . #BrexitIn5Words URL322	X X PUNCT VERB ADP DET ADJ NOUN PUNCT X X
RT @USER2049 : \ Jesus said ' At the moment you do not know what I am doing , but later you will understand . ' \ - John 13:7	X X PUNCT PUNCT PROPN VERB PUNCT ADP DET NOUN PRON AUX PART VERB PRON PRON AUX VERB PUNCT CCONJ ADV PRON AUX VERB PUNCT PUNCT PUNCT PUNCT PROPN X
Congratulatory message for Kstyle 's 4 years ! URL538	NOUN NOUN ADP NOUN PART NUM NOUN PUNCT X
RT @USER957 : What 's real does n't fade away .	X X PUNCT PRON AUX ADJ AUX PART VERB ADV PUNCT
RT @USER2202 : oh nazuna was actually thinking of going back to valkyrie after ra*bits gets on the right track but he does n't want to leave \u2026	X X PUNCT INTJ NOUN AUX ADV VERB ADP VERB ADV ADP NOUN ADP NOUN VERB ADP DET NOUN NOUN CCONJ PRON AUX PART VERB PART VERB PUNCT
RT @USER1882 : old enough URL796	X X PUNCT ADJ ADJ NOUN
RT @USER498 : Crikey ! Manchester United have sacked Louis Van Gaal . Who saw that coming ? Next thing you know they 'll appoint Jos\u00e9 Mourin \u2026	X X PUNCT NOUN PUNCT PROPN PROPN VERB NOUN PROPN PROPN PROPN PUNCT PRON VERB PRON VERB PUNCT ADJ NOUN PRON VERB PRON AUX ADJ X X PUNCT
By Pass ! #np	ADP NOUN PUNCT X
Hold up ?! Knicks beat Bulls back to back ?!	VERB ADP PUNCT NOUN VERB PROPN ADV ADP ADV PUNCT
RT @USER833 : ME - YOU URL1366	X X PUNCT PRON PUNCT PRON NOUN
I am playing Online Head Ball with real players . Download now : URL405 #OnlineHeadball #HeadBall	PRON AUX VERB ADJ NOUN NOUN ADP ADJ NOUN PUNCT NOUN ADV PUNCT X X X
RT @USER1352 : Like a proud papa silverback , just look at this talented cool / hot #Baywatch cast .. ilfenator , \u2026 URL1523	X X PUNCT VERB DET ADJ NOUN NOUN PUNCT ADV VERB ADP DET ADJ ADJ PUNCT ADJ NOUN NOUN PUNCT X PUNCT PUNCT X
RT @USER2074 : Whoa . This letter from @USER2550 on the FBI request is incredible and unprecedented . Read it now . URL1185 \u2026	X X PUNCT NOUN PUNCT DET NOUN ADP NOUN ADP DET PROPN NOUN AUX ADJ CCONJ NOUN PUNCT VERB PRON ADV PUNCT X PUNCT
If you were an elevator , what button would I have to push to get you to go down ? #MyBestPickupLines	SCONJ PRON AUX DET NOUN PUNCT PRON NOUN AUX PRON VERB PART VERB PART VERB PRON PART VERB ADV PUNCT X
RT @USER137 : \ Not that we lord it over your faith , but we work with you for your joy . \ 2 Corinthians 1:24 #GoodFaith URL533 \u2026	X X PUNCT PUNCT ADV PRON PRON NOUN PRON ADP PRON NOUN PUNCT CCONJ PRON VERB ADP PRON ADP PRON NOUN PUNCT PUNCT NUM NOUN X X X PUNCT
RT @USER1137 : British @USER1861 astronaut #TimPeake meets Apollo 15 @USER960 astronaut Al Worden ! #Astronaut #Apollo15 #FIA16 URL1589 \u2026	X X PUNCT ADJ NOUN X X X X NUM NOUN X PROPN NOUN PUNCT X X X X PUNCT
RT @USER2132 : Tell Me What Is Love - D.O ( from EXO ) URL170	X X PUNCT VERB PRON PRON AUX VERB PUNCT NOUN PUNCT ADP NOUN PUNCT X
RT @USER569 : Word URL330	X X PUNCT PROPN X
A cracking in the pattern , a miracle waiting to happen URL285	DET NOUN ADP DET NOUN PUNCT DET NOUN VERB PART VERB X
Just posted a photo URL774	ADV VERB DET NOUN X
RT @USER2081 : Justin Bieber 's Statements About Selena Gomez Will Forever Smash Her Hopes And Dreams see URL927 URL218 \u2026	X X PUNCT PROPN PROPN PART NOUN ADP NOUN NOUN AUX ADV VERB PRON NOUN CCONJ NOUN VERB X X PUNCT
RT @USER1193 : dis could be us but you praying URL318	X X PUNCT PRON AUX AUX PRON CCONJ PRON VERB X
RT @USER2018 : I hate when chicks be like \ At the end of the day he coming home \ud83c\udfe0 to me \ \ud83d\udc81\ud83c\udffe ... DUH !! bitch she ai n't letting his ass stay ov \u2026	X X PUNCT PRON VERB ADV NOUN AUX VERB PUNCT ADP DET NOUN ADP DET NOUN PRON VERB ADV NOUN ADP PRON PUNCT NOUN PUNCT X PUNCT NOUN PRON AUX PART VERB PRON NOUN VERB NOUN PUNCT
RT @USER102 : If you want people to pay to win , make a pay to play game . Do n't pretend that the game is playable for free if you have to \u2026	X X PUNCT SCONJ PRON VERB NOUN PART VERB PART VERB PUNCT VERB DET NOUN PART VERB NOUN PUNCT AUX PART VERB DET DET NOUN AUX NOUN ADP ADJ SCONJ PRON VERB ADP PUNCT
@USER254 they do n't have anything on you bc you 're a bomb ass person \ud83d\ude34\ud83d\ude18	NOUN PRON AUX PART VERB PRON ADP PRON SCONJ PRON AUX DET NOUN NOUN NOUN X
@USER795 nice and cool 72 in my ac fitted home . Should invest . The world@is@only getting warmer	NOUN ADJ CCONJ ADJ NUM ADP PRON NOUN NOUN ADV PUNCT AUX VERB PUNCT DET NOUN VERB X
RT @USER333 : Sometimes I feel like we 're friends , sometimes I feel like we 're more than friends , but sometimes I feel like I 'm just a \u2026	X X PUNCT VERB PRON VERB SCONJ PRON AUX NOUN PUNCT ADV PRON VERB SCONJ PRON AUX ADJ ADP NOUN PUNCT CCONJ ADV PRON VERB SCONJ PRON AUX ADV DET PUNCT
RT @USER628 : Mala tomorrow land \ud83d\ude02\ud83d\ude02 DUTERTE GRAND RALLY URL1378	X X PUNCT X NOUN X X X X X X
Pumping up for game day and Shannon nole comes on	VERB ADP ADP NOUN NOUN CCONJ NOUN NOUN VERB ADP
Marco interrupts the yoga onstage at the #GOPDebate as #Cruz tells #Trump to #breathe . #pranayama for #politicians URL982	PROPN VERB DET NOUN NOUN ADP DET NOUN ADP NOUN VERB NOUN ADP NOUN PUNCT X ADP NOUN X
@USER1339 \u2014 been thwarted whenever they had taken a look at his wings . Something so angelic but in their eyes , he was a monster . \u2014	NOUN PUNCT AUX NOUN ADV PRON VERB VERB DET NOUN ADP PRON NOUN PUNCT NOUN ADV NOUN CCONJ ADP PRON NOUN PUNCT PRON AUX DET NOUN PUNCT PUNCT
@USER1281 @USER1302 handle me with care	NOUN NOUN VERB PRON ADP NOUN
RT @USER1770 : do n't wan na talk to anyone	X X PUNCT AUX PART VERB PART VERB ADP PRON
. @USER536 thanks for the latest #ThreatWire video - ATM skimming up 546 % URL1600	PUNCT NOUN NOUN ADP DET ADJ NOUN NOUN PUNCT NOUN NOUN ADP NOUN SYM X
@USER2053 @USER917 could n't it be considered a positive that it 's not news when something like this happens ?	PROPN NOUN AUX PART PRON AUX VERB DET NOUN SCONJ PRON AUX PART NOUN ADV PRON VERB PRON NOUN PUNCT
RT @USER2167 : \ You better ride that dick like a soldier \ URL634	X X PUNCT PUNCT PRON ADJ VERB DET NOUN ADP DET NOUN PUNCT X
Dover riots : Protesters burnt EU flag as migration anger spirals out of control URL1142	ADJ NOUN PUNCT NOUN NOUN VERB NOUN ADP NOUN NOUN NOUN ADP ADP NOUN X
RT @USER2051 : RT to WIN : ABH 's Moon Child glow kit :) mbf URL1584	X X PUNCT VERB ADP VERB PUNCT X PART NOUN NOUN NOUN X SYM X X
@USER147 Okay , but why ?	PROPN INTJ PUNCT CCONJ ADV PUNCT
There is too many humans here \ud83d\udc7d	PRON AUX ADV ADJ NOUN ADV X
RT @USER2433 : idc what anyone says , it s ok to pay for ya mans meal sometimes . Now a days girls so pressed on the fact that the guy got ta \u2026	X X PUNCT INTJ PRON PRON VERB PUNCT PRON AUX ADJ PART VERB ADP PRON NOUN NOUN ADV PUNCT ADV DET NOUN NOUN ADV VERB ADP DET NOUN DET DET NOUN VERB PART PUNCT
RT @USER396 : Instead of telling everyone about feelings , I choose to keep it all insides by me . Because ppl keep leaving me , I know .	X X PUNCT VERB ADP VERB PRON ADP NOUN PUNCT PRON VERB PART VERB PRON DET NOUN ADP PRON PUNCT SCONJ NOUN VERB VERB PRON PUNCT PRON VERB PUNCT
My head hurts ..........	PRON NOUN NOUN X
RT @USER2083 : Bitches live for the internet flex \ud83d\ude29	X X PUNCT VERB VERB ADP DET NOUN NOUN X
The revolution may be televised ...	DET NOUN AUX AUX NOUN PUNCT
URL844 Cadet World Team training at Harwich , fantastic weather , a great team .... yes this is Great Britain @USER486	PROPN NOUN PROPN NOUN NOUN ADP NOUN PUNCT NOUN NOUN PUNCT DET ADJ NOUN PUNCT INTJ PRON AUX ADJ PROPN X
RT @USER1501 : If elected Mayor , I 'll improve London 's living environment . Add your name to back my plan : URL1385 URL218 \u2026	X X PUNCT SCONJ NOUN NOUN PUNCT PRON AUX VERB PROPN PART VERB NOUN PUNCT VERB PRON NOUN PART ADV PRON NOUN PUNCT X X PUNCT
Lowe 's purchase of RONA positive for ... : LITTLE CURRENT \u2014 American retailing giant Lowe 's Company Inc. is purcha ... URL958	NOUN PART NOUN ADP NOUN NOUN ADP PUNCT PUNCT X X PUNCT ADJ NOUN ADJ NOUN PART PROPN NOUN AUX NOUN PUNCT X
\u201c @USER1939 : Call yo friends let 's get DRUNK \ud83d\ude1b URL919 \u201d	PUNCT NOUN PUNCT VERB PRON NOUN VERB PART VERB NOUN X X PUNCT
RT @USER2056 : for a wife , for a husband . To whoever you date ; are they the one or are you just playing games ? URL802	X X PUNCT ADP DET NOUN PUNCT ADP DET NOUN PUNCT PART NOUN PRON NOUN PUNCT AUX PRON DET NOUN CCONJ AUX PRON ADV VERB NOUN PUNCT X
@USER850 is @USER2377 3rd wife and his children are from all three not very Christian	NOUN AUX VERB NOUN NOUN CCONJ PRON NOUN AUX ADP DET NUM ADV ADV ADJ
RT @USER393 : [ ! ] 160601 EXO 's 3rd full length album is titled EX ' ACT URL320	X X PUNCT PUNCT PUNCT PUNCT X X PART NOUN ADJ NOUN NOUN AUX ADJ X PUNCT X X
RT @USER281 : Cat Scared Of Vacuum Cleaner | Funny Video Cat 2016 | Meo Cover House - URL305	X X PUNCT NOUN ADJ ADP NOUN NOUN SYM ADJ NOUN NOUN NUM SYM X PROPN NOUN PUNCT X
RT @USER2276 : The Dark Secrets Of ' Full House ' Will Blow Your Mind URL1296	X X PUNCT DET NOUN NOUN ADP PUNCT ADJ NOUN PUNCT VERB VERB PRON NOUN X
Exclusive first look at Cross Border VAT on Thursday 12th May URL995	ADJ ADJ VERB ADP NOUN NOUN NOUN ADP PROPN NOUN NUM X
' House of Cards ' season 5 spoilers : Claire destroys Frank while Doug finds love in new season ? - ChristianToday URL1055	PUNCT NOUN ADP NOUN PUNCT NOUN NUM NOUN PUNCT X X PROPN SCONJ PROPN VERB NOUN ADP ADJ NOUN PUNCT PUNCT X X
That flash tho x2 URL1323	PRON NOUN ADV SYM X
Csgo #ELEAGUE live on #tbs !!!!!!! URL1571	NOUN NOUN VERB ADP NOUN PUNCT X
@USER622 \ I think you are fortunate she has a tender heart . I would suffer her wrath if we fought . But I am watching you . \	NOUN PUNCT PRON VERB PRON AUX VERB PRON VERB DET NOUN NOUN PUNCT PRON AUX VERB PRON NOUN SCONJ PRON NOUN PUNCT CCONJ PRON AUX VERB PRON PUNCT PUNCT
RT @USER1544 : 3 more months until graduation \ud83d\udc83\ud83c\udfff	X X PUNCT NUM ADJ NOUN ADP X X
RT @USER128 : GIMME URL283	X X PUNCT X X
#LetterFromTheBrooks please choose me , a will frame it & put it on my wall \ud83d\udcc3 !!!!! I love & miss use sm \ud83d\ude18 @USER1368 \ud83d\ude07	PROPN INTJ VERB PRON PUNCT DET AUX VERB PRON CCONJ VERB PRON ADP PRON NOUN NOUN PUNCT PRON VERB CCONJ VERB VERB X SYM X X
RT @USER2180 : How much longer can @USER1037 ignore #USURY and #PAEDOPHILA and hide #EMBRYOLOGY from MOTHERS ? Such simple math / science . @ \u2026	X X PUNCT ADV ADV ADV AUX VERB VERB NOUN CCONJ NOUN CCONJ VERB NOUN ADP NOUN PUNCT VERB ADJ NOUN PUNCT NOUN PUNCT ADP PUNCT
Ok done being sap . Here 's Zola waiting for her treat \ud83d\udc36 URL1337	INTJ ADV AUX NOUN PUNCT ADV PART NOUN VERB ADP PRON NOUN X X
RT @USER1186 : RT IF #GreenWall URL643	X X PUNCT X PRON X X
URL490 Temp : 8.7 \u00b0C Wind : 6.9 mph Pressure : 1010.6 mb Falling Rain Today 0.0 mm Hum 69 % Fc : Occasional precipitation , worsening	ADJ NOUN PUNCT NOUN NOUN NOUN PUNCT NOUN X X PUNCT X NOUN VERB NOUN NOUN NUM NUM NOUN NOUN SYM X PUNCT X X PUNCT X
RT @USER2016 : Bellerin was member in PFA team of a year and Ismed Sofyan can deliver much better cross than him .	X X PUNCT NOUN AUX NOUN ADP NOUN NOUN ADP DET NOUN CCONJ NOUN NOUN AUX VERB ADV ADJ NOUN ADP PRON PUNCT
finna hit him with that \ you up \ text \ud83d\ude29	NOUN VERB PRON ADP PRON PUNCT PRON ADP PUNCT NOUN SYM
RT @USER2598 : \ when did you start crying ? \ URL835	X X PUNCT PUNCT ADV VERB PRON VERB VERB PUNCT PUNCT X
@USER1844 @USER2432 we all know that jen wants jimin :)	PROPN NOUN PRON DET VERB PRON NOUN VERB NOUN SYM
RT @USER448 : These crossover episodes were lit URL974	X X PUNCT DET NOUN NOUN AUX ADJ X
@USER1446 what ? \ud83d\ude02\ud83d\ude02\ud83d\ude02	VERB PRON PUNCT SYM
RT @USER1445 : The world not ready URL1605	X X PUNCT DET NOUN PART ADJ X
RT @USER914 : Never give up on someone you ca n't go a day without thinking about .	X X PUNCT ADV VERB ADP ADP PRON PRON AUX PART VERB DET NOUN ADP VERB ADP PUNCT
Lee Joon fights the temptation to suck ? URL583 #kpop #kpopmusic	PROPN NOUN VERB DET NOUN ADP NOUN PUNCT X X X
AllGreen News : URL276 Top posts from : @USER1716 @USER319	NOUN NOUN PUNCT NOUN ADJ NOUN ADP PUNCT X X
Shades Of Childhood Ruined , Make Sure You Close Your Eyes URL1291 URL1236	NOUN ADP NOUN NOUN PUNCT VERB INTJ PRON VERB PRON NOUN X X
Philips B 120 In.Sight Wireless HD Baby Monitor For IOS iPad iPhone Camera URL1089	NOUN AUX ADJ NOUN NOUN NOUN NOUN NOUN ADP NOUN NOUN PROPN NOUN X
@USER2641 actually let all ships in svtfoe be platonic	NOUN ADV VERB DET NOUN ADP NOUN AUX X
RT @USER2160 : 4x cause i liked my outfit from yesterday \ud83d\udc99 URL991	X X PUNCT NOUN SCONJ PRON VERB PRON NOUN ADP NOUN SYM X
Kingpin killed as robbers , police engage in shootout in Aba URL1632	NOUN VERB ADP NOUN PUNCT NOUN NOUN ADP NOUN ADP NOUN X
@USER2108 I wan na comment on your lovely smile but Dems gets all my attention . His unlooking is TIGHT !	PROPN PRON VERB PART VERB ADP PRON ADJ NOUN CCONJ VERB VERB DET PRON NOUN PUNCT PRON NOUN AUX NOUN PUNCT
You ai n't lying b \ud83d\ude02\ud83d\ude02 URL511	PRON AUX PART VERB CCONJ SYM X
RT @USER972 : When are we going to run out of usernames ?	X X PUNCT ADV AUX PRON VERB PART VERB ADP ADP NOUN PUNCT
RT @USER1697 : Follow everyone who retweets this \ud83d\udc40	X X PUNCT VERB PRON PRON VERB PRON NOUN
Multibionta 50 + Tablets - 30 Tablets - Pack of 2 - URL1529	NOUN NUM SYM NOUN PUNCT NUM NOUN PUNCT NOUN ADP NUM PUNCT X
@USER1379 hi tisha hope you and your family are well take care \ud83d\ude00 xxxdavid	PROPN INTJ NOUN VERB PRON CCONJ PRON NOUN AUX ADV VERB NOUN SYM X
@USER194 #FiresideBricky meal . Chicken noodle soup and chai tea . URL669	NOUN NOUN NOUN PUNCT NOUN NOUN NOUN CCONJ NOUN NOUN PUNCT X
RT @USER2112 : The heart wants what it wants	X X PUNCT DET NOUN VERB PRON PRON VERB
RT @USER1570 : if i cry in front of you , just know , i reached my limit	X X PUNCT SCONJ PRON VERB ADP NOUN ADP PRON PUNCT ADV VERB PUNCT PRON VERB PRON NOUN
I left my yeti cup at my house this morning and come back to it just now to see that there is still ice in it \ud83d\ude0d\ud83d\udc4d\ud83c\udffc	PRON VERB PRON NOUN NOUN ADP PRON NOUN DET NOUN CCONJ VERB ADV ADP PRON ADV ADV PART VERB PRON PRON AUX ADV VERB ADP PRON NOUN
Fuck sake Ronaldo \ud83d\ude20 #Euros2016	INTJ NOUN NOUN X X
@USER1387 what that mouth do	VERB PRON PRON NOUN AUX
RT @USER352 : HOW DOES BEN SIMMONS MAKE THIS PASS ? URL929	X X PUNCT ADV NOUN NOUN X VERB PRON NOUN PUNCT X
@USER555 these kids on UMG but we won first then my teammates host was shit and last map went round 11	VERB DET NOUN ADP NOUN CCONJ PRON VERB ADV ADV PRON NOUN NOUN AUX NOUN CCONJ ADJ NOUN VERB VERB NUM
RT @USER472 : \ How old are u ? \ * says age * \ Awwww u r a baby ! \ URL416	X X PUNCT PUNCT ADV ADJ AUX PRON PUNCT PUNCT PUNCT VERB NOUN PUNCT PUNCT VERB PRON AUX DET NOUN PUNCT PUNCT X
@USER1469 I watched the first three seasons , and i really liked it lol . Have nt seen it since though , i do nt watch much tv anymore .	PROPN PRON VERB DET ADJ NUM NOUN PUNCT CCONJ PRON ADV VERB PRON INTJ PUNCT AUX PART VERB PRON ADV ADV PUNCT PRON AUX PART VERB ADV NOUN ADV PUNCT
RT @USER871 : me as an eyeshadow URL1543	X X PUNCT PRON ADP DET NOUN X
I found 494 people do not follow me back ( via URL1135 )	PRON VERB NOUN NOUN AUX PART VERB PRON ADV PUNCT ADP NOUN PUNCT
@USER183 do n't think the team had much say in where they drafted .	NOUN AUX PART VERB DET NOUN VERB ADV VERB ADP ADV PRON NOUN PUNCT
RT @USER541 : What if his name was James boob instead of James Bond haha	X X PUNCT PRON SCONJ PRON NOUN AUX PROPN NOUN ADV ADP PROPN PROPN INTJ
@USER190 @USER2091 she does nt read email , only k3 - mail and KKC - mail	PROPN PROPN PRON AUX PART VERB NOUN PUNCT ADV NOUN PUNCT NOUN CCONJ NOUN PUNCT NOUN
Cuba does n\u2019t have trendy food trucks as some places do , but it does have an outdoor hot dog stand if you are ... URL1489	PROPN AUX PART VERB VERB NOUN NOUN ADP DET NOUN VERB PUNCT CCONJ PRON AUX VERB DET ADJ ADJ NOUN VERB SCONJ PRON AUX PUNCT X
RT @USER1263 : by Finbarr Notte , inspired in the amazing beauty of #lacandelaviva #streetart @USER2141 @USER1888 URL574 \u2026	X X PUNCT ADP PROPN NOUN PUNCT VERB ADP DET ADJ NOUN ADP NOUN X X X X PUNCT
Be first to apply - Retail Store Manager in Santa Cruz , CA URL984 #job	AUX ADJ ADP VERB PUNCT NOUN X NOUN ADP PROPN PROPN PUNCT PROPN X X
Gamer thug tears URL519	NOUN NOUN NOUN NOUN
RT @USER426 : RT @USER655 : Day 1 of install at #FDIC2016 URL1215	X X PUNCT X X PUNCT NOUN NUM ADP NOUN ADP NOUN X
RT @USER1443 : \ I hate Donald Trump \ URL1255	X X PUNCT PUNCT PRON VERB PROPN PROPN PUNCT X
RT @USER2597 : THE SEX SCENE URL383	X X PUNCT DET NOUN X X
not going to change ...... lol	PART VERB PART VERB NOUN INTJ
RT @USER1199 : Tonight the @USER1200 World Tour kicks off with #ShawnWorldTourCologne \ud83d\ude46\ud83c\udffb URL1629	X X PUNCT VERB DET ADJ PROPN NOUN NOUN ADP ADP NOUN X X
RT @USER1275 : @USER737 @USER1807 I like that \ United States of America V Pete Santili \ hahahaha #Oregonstandoff	X X PUNCT NOUN X PRON VERB PRON PUNCT PROPN PROPN ADP PROPN PROPN NOUN X PUNCT INTJ X
' Pepper Spray Cop ' Gets $ 38,000 in Workers ' Comp URL702	PUNCT NOUN NOUN NOUN PUNCT NOUN SYM NOUN ADP NOUN PUNCT X X
Expect you to change it , but I like Roman . It 'll forever remind me about earlier . \ @USER794	VERB PRON PART VERB PRON PUNCT CCONJ PRON VERB NOUN PUNCT PRON AUX ADV VERB PRON ADP NOUN PUNCT PUNCT X
I need a new phone case \ud83d\ude16	PRON VERB DET ADJ NOUN NOUN X
RT @USER1102 : Thanks to U.S. Imperialism and Racism , Attacks on Muslims in Europe Increase - URL1332 URL424 \u2026	X X PUNCT NOUN ADP PROPN NOUN CCONJ NOUN PUNCT NOUN ADP NOUN ADP NOUN NOUN PUNCT X X PUNCT
RT @USER1150 : Qualify for a Place at the #AV/IT Leadership Summit , Aug 10 - 11 , in NYC #AVtweeps URL1127	X X PUNCT NOUN ADP DET NOUN ADP DET NOUN NOUN NOUN PUNCT PROPN NUM PUNCT NUM PUNCT ADP NOUN X X
@USER203 waiting for buses to celebrate #July4Canada URL1608	NOUN VERB ADP NOUN PART VERB NOUN X
RT @USER1047 : Rockstar in pune URL354	X X PUNCT NOUN ADP NOUN X
RT @USER1808 : get yourself a girl who can do both URL937	X X PUNCT VERB PRON DET NOUN PRON AUX VERB DET NOUN
RT @USER2043 : #GrowingUpUgly #GrowingUpFat Not having crushes because you automatically know they 're not gon na like you back	X X PUNCT NOUN NOUN PART VERB NOUN SCONJ PRON ADV VERB PRON AUX PART VERB PART SCONJ PRON ADV
@USER1788 this weekend will be good tho	VERB DET NOUN AUX AUX ADJ ADV
I leave for college in 51 days \ud83d\ude1d\ud83d\ude1d	PRON VERB ADP NOUN ADP NOUN NOUN X
Iron Man , the Hulk and Frozen 's Anna arrested in New York - Evening Express URL297 via @USER421	NOUN NOUN PUNCT DET NOUN CCONJ NOUN PART PROPN NOUN ADP ADJ PROPN PUNCT X X X ADP X
did we bother to ask if we should \u2019ve let this happen URL1622	AUX PRON VERB PART VERB SCONJ PRON AUX VERB VERB PRON VERB X
RT @USER2386 : do U think uber drivers get lonely when their passengers leave	X X PUNCT AUX PRON VERB NOUN NOUN VERB NOUN ADV PRON NOUN VERB
RT @USER1868 : My #TeenChoice for #ChoiceModel is @USER507	X X PUNCT PRON NOUN ADP NOUN AUX X
@USER245 both	NOUN DET
#Taurus Dolls make awesome moms ! They 're strict and loving .	PROPN NOUN VERB ADJ NOUN PUNCT PRON AUX NOUN CCONJ VERB PUNCT
Driver continuing to drive around 60 - 65 miles an hour on 91 Eastbound . @USER210 #KCAL9	NOUN NOUN PART NOUN ADP NUM PUNCT NOUN NOUN DET NOUN ADP NOUN NOUN PUNCT X X
RT @USER525 : Our tennis warm up \ud83c\udfbe @USER300 URL948	X X PUNCT PRON NOUN ADJ ADP NOUN X X
[ eBay.ca ] Nexus 5x $ 31 free shipping URL327 URL1250	PUNCT NOUN PUNCT X NOUN SYM NUM ADJ NOUN X X
so at least I broke 1600 . Still sad I did n't make 1700 though . If only I had good teammates earlier , then I probably would 've made it	ADV ADV ADV PRON VERB NOUN PUNCT ADV ADJ PRON AUX PART VERB NOUN ADV PUNCT SCONJ ADV PRON VERB ADJ NOUN NOUN PUNCT ADV PRON ADV AUX AUX VERB PRON
@USER2140 oh shoot I ai n't getting that I need to look poppin in flash pics	PROPN INTJ NOUN PRON AUX PART VERB SCONJ PRON VERB PART VERB NOUN ADP NOUN NOUN
Let your workings remain a mystery . Just show people the results . - Lao - tzu URL602	VERB PRON NOUN NOUN DET NOUN PUNCT ADV NOUN NOUN DET NOUN PUNCT PUNCT X PUNCT X X
RT @USER766 : RT for the chance to WIN this Minority Report inspired T-shirt before we officially release it . URL870	X X PUNCT VERB ADP DET NOUN PART VERB DET NOUN NOUN NOUN NOUN SCONJ PRON NOUN VERB PRON PUNCT X
RT @USER1193 : If you do n't think your friends have the ability to break your heart , you are so so wrong .	X X PUNCT SCONJ PRON AUX PART VERB PRON NOUN VERB DET NOUN PART VERB PRON NOUN PUNCT PRON AUX ADV ADV ADJ PUNCT
RT @USER2039 : At this point I do n't care if I 'm rude to guys like what part do n't ya fucking understand I do n't wan na talk to anyone	X X PUNCT ADP DET NOUN PRON AUX PART VERB SCONJ PRON AUX VERB PART NOUN SCONJ PRON NOUN AUX PART PRON ADV VERB PRON AUX PART VERB PART VERB ADP PRON
@USER2179 Help us win & rt these 2 links please ? Thank you & have an amazing day ! \ud83d\udc95 URL798 URL853	NOUN VERB PRON VERB CCONJ VERB DET NUM NOUN INTJ PUNCT VERB PRON CCONJ VERB DET ADJ NOUN PUNCT X X X
They are so cute . Congratulations . May Allah continue to bless your union . We need more cuties oh URL584	PRON AUX ADV ADJ PUNCT NOUN PUNCT PROPN PROPN VERB PART VERB PRON NOUN PUNCT PRON VERB ADV NOUN INTJ X
Delhi air will never be safe because of its geographical disadvantage : panel to HC URL1614	NOUN NOUN AUX ADV AUX ADJ ADV ADP DET NOUN NOUN PUNCT X ADP X X
Bullet with butterfly wings .	NOUN ADP NOUN NOUN PUNCT
When BB is perfect \ud83d\ude29\ud83d\ude0d\ud83d\ude4c @USER1548 URL458	ADV NOUN AUX ADJ NOUN X X
@USER1026 PLEASE EXPLAIN TO ME WHY YOU TELLING ME TO SHUT UP WILL ACTUALLY GET ME TO SHUT UP	PROPN INTJ VERB ADP PRON ADV PRON VERB PRON PART NOUN ADP AUX VERB VERB PRON ADP NOUN ADP
RT @USER1549 : \ wyd this weekend ? \ URL871	X X PUNCT PUNCT VERB DET NOUN PUNCT PUNCT X
Thankful for another 24	NOUN ADP DET NUM
@USER1833 Imma stay at your pad	NOUN VERB VERB ADP PRON NOUN
um can one of my friends pick me up so we can go riding around & talking ?	INTJ AUX NUM ADP PRON NOUN VERB PRON ADP ADV PRON AUX VERB VERB ADP CCONJ VERB PUNCT
@USER881 I suspect @USER786 's involvement now :/	PROPN PRON VERB NOUN PART NOUN ADV SYM
RT @USER1280 : This is your chance to ask question to LizQuen using ASK TatakLizQuen DolceAmore GrandFansDate #VoteEnriqueFPP #KCA URL0 \u2026	X X PUNCT PRON AUX PRON NOUN PART VERB NOUN PART NOUN VERB X X X X X X X PUNCT
RT @USER1262 : Your child reading before kindergarten ! This guide can make it happen #kindergarten #ASMSG URL459	X X PUNCT PRON NOUN VERB ADP NOUN PUNCT DET NOUN AUX VERB PRON VERB X X X
RT @USER1805 : Check out my article about Darren Espanto : URL1153 @USER1025 URL277	X X PUNCT VERB ADP PRON NOUN ADP NOUN X PUNCT X X X
RT @USER1241 : When Taeyeon went on the lift during \ U R \ and confetti fell , Yoona 's jaw dropped and she took a video of it . URL224 \u2026	X X PUNCT ADV NOUN VERB ADP DET NOUN NOUN PUNCT PRON X PUNCT CCONJ NOUN VERB PUNCT PROPN PART NOUN NOUN CCONJ PRON VERB DET NOUN ADP PRON PUNCT X PUNCT
Excellent condition 1 BR in an Elevator building ( Gramercy ) $ 3825 1 bd URL478 URL575 #roommate	NOUN NOUN NUM NOUN ADP DET NOUN NOUN PUNCT NOUN PUNCT SYM NOUN NUM X X X X
URL988 Hey ! Check URL1640 for latest cs:go giveaways , free and no sign up needed ;)	PROPN INTJ PUNCT VERB NOUN ADP ADJ NOUN NOUN PUNCT ADJ CCONJ DET NOUN ADP VERB SYM
RT @USER25 : Laurmani in red appreciation tweet #VeranoMTV2016 Fifth Harmony URL585	X X PUNCT NOUN ADP ADJ NOUN NOUN X X PROPN X
@USER2400 you thought	VERB PRON VERB
RT @USER1702 : hate is never the answer .	X X PUNCT VERB AUX ADV DET NOUN PUNCT
RT @USER1320 : VIDEO : Russian jets violently disrupt Free Syrian Army ceremony in western #Daraa URL402 URL1544 \u2026	X X PUNCT NOUN PUNCT X X X X ADJ NOUN X NOUN ADP ADJ NOUN X X PUNCT
RT @USER2545 : When you go through deep waters , I will be with you . Isaiah 43:2	X X PUNCT ADV PRON VERB ADP ADJ NOUN PUNCT PRON AUX AUX ADP PRON PUNCT X X
