@USER2460 Me too . Looking forward to the delivery tomorrow .	VERB PRON ADV PUNCT VERB ADV ADP DET NOUN NOUN PUNCT
It s a legit hustle URL408	PRON AUX DET NOUN NOUN X
RT @USER1425 : The UNCOMFORTABLE CONVERSATIONS series starts today !!! Make sure your there !!! @ LTB 5 , 6 - 8 PM . URL1048	X X PUNCT DET NOUN NOUN NOUN VERB NOUN PUNCT VERB ADJ PRON ADV PUNCT ADP NOUN NUM PUNCT NUM PUNCT NUM NOUN PUNCT X
'Cause I 'm as free as a bird now	PROPN PRON AUX ADV ADJ ADP DET NOUN ADV
Oh goddam nit I cried at work again	INTJ NOUN VERB PRON VERB ADP NOUN ADV
RT @USER2453 : @USER1838 good evening ! ( japan time ) ! Thank you very much ! Friendly Corina Dumitrescu 's ! Nature is Beautiful ! spen \u2026	X X PUNCT VERB ADJ NOUN PUNCT PUNCT NOUN NOUN PUNCT PUNCT VERB PRON ADV ADV PUNCT ADJ NOUN X PART PUNCT NOUN AUX ADJ PUNCT X PUNCT
Joebarly Feat. HitMaker Q \u2013 Widd It URL1474 Major #HipHop	NOUN PROPN NOUN NOUN PUNCT VERB PRON NOUN ADJ NOUN
... Do n't look at me like that . You and I both know there 's nothing I can do .	PUNCT AUX PART VERB ADP PRON ADP PRON PUNCT PRON CCONJ PRON VERB VERB PRON AUX PRON PRON AUX VERB PUNCT
All I did was unpack my shoes / purses ... I feel like I unpacked a whole damn house \ud83d\ude28\ud83d\ude16	DET PRON AUX AUX VERB PRON NOUN PUNCT NOUN PUNCT PRON VERB SCONJ PRON VERB DET ADJ ADJ NOUN X
@USER1927 thank you for making sure that is exactly what is going to happen . #ARSAVL	PROPN VERB PRON ADP VERB ADJ PRON AUX ADV PRON AUX VERB PART VERB PUNCT X
Get Lost Moon for FREE on URL358 - your weekly game #giveaway #orlygift #steam #indi	VERB NOUN NOUN ADP ADJ ADP NOUN PUNCT PRON NOUN NOUN NOUN X X X
RT @USER2284 : #Housing Shortages Stifle Sales Contracts URL1476 - more from @USER2379 #realestate #phs URL224 \u2026	X X PUNCT X X X NOUN NOUN NOUN PUNCT ADJ ADP NOUN X X X PUNCT
lowkey obsessed with me before you	NOUN NOUN ADP PRON SCONJ PRON
#DolceAmorePuSo TWEET BOOST ! NOW TRENDING ! DOLCE AMORE lsmlm	PROPN VERB NOUN PUNCT ADV NOUN PUNCT X X X
RT @USER1131 : Omg I 'm at this youtube party and these people write first impression judgments of you LOL @USER1327 URL1086 \u2026	X X PUNCT INTJ PRON AUX ADP DET NOUN NOUN CCONJ DET NOUN VERB ADJ NOUN NOUN ADP PRON INTJ X X PUNCT
RT @USER2171 : To love someone is to see a miracle invisible to others . #ALDUBSeeYouSoon	X X PUNCT PART VERB PRON AUX PART VERB DET NOUN NOUN ADP NOUN PUNCT X
RT @USER1618 : This how you need to be thinking girls . URL500	X X PUNCT PRON ADV PRON VERB PART AUX VERB NOUN PUNCT X
RT @USER2272 : Most subscribed music artists on YouTube : # 1 Justin Bieber # 2 Rihanna # 3 One Direction # 4 Taylor Swift URL852 \u2026	X X PUNCT ADJ NOUN NOUN NOUN ADP NOUN PUNCT NOUN NUM PROPN PROPN NOUN NUM PROPN NOUN NUM NUM NOUN NOUN NUM PROPN PROPN X PUNCT
RT @USER1778 : 10 Worst Feelings : Cheated on Over thinking Lied to Heart broken Not cared for Losing Scared Assuming Nervous Letting go	X X PUNCT NUM ADJ NOUN PUNCT VERB ADP ADV VERB VERB ADP NOUN NOUN PART VERB ADP VERB ADJ VERB ADJ VERB VERB
RT @USER817 : The \ Laugh at me one more time \ starter pack URL357	X X PUNCT DET PUNCT NOUN ADP PRON NUM ADJ NOUN PUNCT X NOUN X
Jessica watched @USER980 and his schemy little smirk before she rolled her hazel hues at his response . \ I 'm glad I got your ~~	PROPN VERB NOUN CCONJ PRON NOUN ADJ NOUN SCONJ PRON VERB PRON NOUN NOUN ADP PRON NOUN PUNCT PUNCT PRON AUX ADJ PRON VERB PRON NOUN
RT @USER1340 : I 'm the type of person to never get any sleep because all I do each night is overthink the smallest shit that shouldn ' \u2026	X X PUNCT PRON AUX DET NOUN ADP NOUN PART ADV VERB DET NOUN SCONJ DET PRON VERB DET NOUN AUX VERB DET NOUN NOUN PRON NOUN PUNCT PUNCT
RT @USER1413 : Ever eaten a banana with black spots ? This is what they 're doing to you : URL873	X X PUNCT ADV VERB DET NOUN ADP ADJ NOUN PUNCT PRON AUX PRON PRON AUX VERB ADP PRON PUNCT X
The Wrong Trousers #CowellsChildrensTitles	DET ADJ NOUN X
RT @USER2406 : Leigh Anne Pinnock URL1494	X X PUNCT X X X X
RT @USER1988 : There is a difference between intuition & fear they both can serve as guides , but only the intuition feels comfortable	X X PUNCT PRON AUX DET NOUN ADP NOUN CCONJ NOUN PRON ADV AUX VERB ADP NOUN PUNCT CCONJ ADV DET NOUN VERB ADJ
RT @USER383 : What ? You expect her to wear a suit at the beach ? URL1586	X X PUNCT PRON PUNCT PRON VERB PRON PART VERB DET NOUN ADP DET NOUN PUNCT X
RT @USER1634 : We want a #newsarunshow with @USER138 #BarunSobti & #SanayaIrani ( #Sarun ) on @USER1250 @USER1950 URL224 \u2026	X X PUNCT PRON VERB DET NOUN ADP NOUN NOUN CCONJ NOUN PUNCT NOUN PUNCT ADP NOUN X X PUNCT
RT @USER2376 : every morning is a continuous cycle of wow i ca n't wait to go to bed tonight	X X PUNCT DET NOUN AUX DET NOUN NOUN ADP INTJ PRON AUX PART VERB PART VERB ADP NOUN NOUN
1,000,000 Real YouTube Views , $ 2000 !! URL524	NOUN ADJ NOUN NOUN PUNCT SYM NOUN PUNCT X
RT @USER1755 : Beer Director Greg Engert getting ready to taste some springtime brews on @USER1704 !	X X PUNCT NOUN PROPN NOUN NOUN VERB ADJ PART VERB DET NOUN NOUN ADP NOUN PUNCT
RT @USER916 : Found some cool fans at the @USER760 display who have NO idea I 'm about to surprise them w/ pre-race passes ! \ud83c\udf89 - JW URL0 \u2026	X X PUNCT VERB DET ADJ NOUN ADP DET NOUN NOUN PRON VERB DET NOUN PRON AUX ADP PART VERB PRON VERB NOUN NOUN PUNCT X PUNCT X X PUNCT
RT @USER1960 : Uncountable ! #ServicesByMSG . Are going Onn Across The Globe under HIS HOLINESS @USER530 ' :-) URL1360	X X PUNCT NOUN PUNCT NOUN PUNCT AUX VERB NOUN X DET NOUN NOUN PRON NOUN X PUNCT SYM X
RT @USER291 : I love this cat . URL1120	X X PUNCT PRON VERB DET NOUN PUNCT X
#VeranoMTV2016 5 Seconds of Summer 16	NOUN NUM NOUN ADP NOUN NUM
RT @USER2282 : HARRY IS STRONG BUT CA N'T EVEN OPEN A BAG OF GOLDFISH URL389	X X PUNCT NOUN AUX NOUN CCONJ PROPN AUX VERB ADP DET NOUN ADP NOUN X
North Ends getting a theatre \ud83e\udd18\ud83c\udffb\ud83d\ude0d URL819	PROPN ADV VERB DET NOUN NOUN X
RT @USER2394 : 26 . dick and dom in da bungalow they were just discount ant and dec but i loved it anyway URL1270	X X PUNCT NUM PUNCT NOUN CCONJ NOUN ADP DET NOUN PRON AUX ADV NOUN NOUN CCONJ NOUN CCONJ PRON VERB PRON ADV X
k but @USER2313 is legit cute af so I 'm confused \ud83d\ude29	NUM CCONJ NOUN AUX NOUN ADJ NOUN ADV PRON AUX ADJ SYM
#pray Jehovah Sabaoth restore Jamaican lady 's privacy Completely & vindicate her sanity & reports of thugs ' 24 hr stalking & eavesdroppin IJN	PROPN PROPN NOUN X X NOUN PART NOUN ADV CCONJ VERB PRON NOUN CCONJ NOUN ADP NOUN PUNCT NUM NOUN X CCONJ X X
Like 8 hours ago URL1579	VERB NUM NOUN ADV X
Why are you turning on me ???	ADV AUX PRON VERB ADP PRON PUNCT
RT @USER1402 : This is a real fight URL609	X X PUNCT PRON AUX DET ADJ NOUN X
RT @USER2510 : Chelsea owner Roman Abramovich having second thoughts about Jose ... URL723 #Pep_Guardiola #Jose_Mourinho	X X PUNCT PROPN NOUN NOUN NOUN VERB ADJ NOUN ADP PROPN PUNCT X X X
Wife Catches Her Husband With Mistress And Beats The Hell Out Of Her ( Photos ) URL627	NOUN VERB PRON NOUN ADP NOUN CCONJ VERB DET NOUN ADP ADP PRON PUNCT NOUN PUNCT X
Time to Make your #MomentsThatCount at #NissanPavilion by having a glimpse of ICC T20 trophy watch here >>> URL1604	NOUN PART VERB PRON NOUN ADP NOUN ADP VERB DET NOUN ADP PROPN NOUN NOUN VERB ADV X X
WWW #MTVHottest Little Mix	ADJ NOUN NOUN NOUN
Our brand new Moon Babe with hair buns in the beauteous home of @USER1630 | Available \u2026 URL1186	PRON NOUN ADJ NOUN NOUN ADP NOUN NOUN ADP DET NOUN NOUN ADP NOUN SYM ADJ PUNCT X
\ud83d\udc49 URL501 \ud83d\udc48 Real women to sex with \u2705 Fully free now \ud83d\udd1e #anikka #angelina #analporn #animation	NOUN NOUN NOUN ADJ NOUN ADP NOUN ADP NOUN NOUN ADJ ADV X X X X X
I got a traveler insta it 's fr just pictures I 've shot while traveling n exploring do n't have to follow me but just take a peek ig : stevoohhh	PRON VERB DET NOUN NOUN PRON AUX ADJ ADV NOUN PRON AUX NOUN SCONJ NOUN CCONJ NOUN AUX PART VERB PART VERB PRON CCONJ ADV VERB DET NOUN NOUN PUNCT X
Tory Lanez - Say It URL479 #hiphop #music #Verified #rt	NOUN NOUN PUNCT VERB PRON NOUN X X X X
RT @USER597 : R\u00e9sum\u00e9 : Makes $ 35 k a year but will break your kindergartner 's ankles URL573	X X PUNCT NOUN PUNCT VERB SYM NOUN X DET NOUN CCONJ AUX VERB PRON NOUN PART NOUN X
themselves as russian URL782	PRON ADP NOUN X
@USER402 makeup revolution basically dupes high end makeup it 's where I get all my stuff lmao	PROPN NOUN NOUN ADV NOUN ADJ NOUN NOUN PRON AUX ADV PRON VERB DET PRON NOUN INTJ
RT @USER2206 : when the people you thought are quiet pero dili diay orayt URL760	X X PUNCT ADV DET NOUN PRON VERB AUX ADJ NOUN X X X X
RT @USER1589 : Me Myself and I by G Eazy | Cover by Alex Aiono : URL361 via @USER1490	X X PUNCT PRON PRON CCONJ PRON ADP PROPN NOUN SYM PROPN ADP PROPN NOUN PUNCT X ADP PROPN
@USER500 haha that 's so cool !! I plan on getting a cap shield eventually when I have money to blow . Tweet a pic of the suit !!	PROPN INTJ PRON AUX ADV ADJ PUNCT PRON VERB ADP VERB DET NOUN NOUN NOUN ADV PRON VERB NOUN ADP VERB PUNCT VERB DET NOUN ADP DET NOUN PUNCT
BJ the Chicago Kid Talks Kendrick Lamar & Repping the ' New R&B ' on Motown Debut Album : Moving to Los Angeles a ... URL772	VERB DET PROPN NOUN PROPN NOUN NOUN CCONJ VERB DET PUNCT ADJ PROPN PUNCT ADP NOUN X NOUN PUNCT VERB ADP PROPN NOUN DET PUNCT X
@USER2150 @USER2103 I need to check this out ! Thanks #saskedchat	PROPN VERB PRON VERB PART VERB PRON ADV PUNCT NOUN X
RT @USER2231 : We are live now !!!! URL1389 URL1033	X X PUNCT PRON AUX VERB ADV PUNCT X X
RT @USER2409 : #KanhaiyaKumar bail plea #adjourned to Feb. 29 URL814 URL443	X X PUNCT X X X X ADP NUM NUM X X
RT @USER1443 : \ Can i have a bite \ Me : URL1243	X X PUNCT PUNCT AUX PRON VERB DET NOUN PUNCT PRON PUNCT X
RT @USER128 : Look at that face . The joys of being a parent URL730	X X PUNCT VERB ADP DET NOUN PUNCT DET NOUN ADP AUX DET NOUN X
RT @USER2590 : in the mood for a long drive with no destination	X X PUNCT ADP DET NOUN ADP DET ADJ NOUN ADP DET NOUN
RT @USER161 : throwback to this amazing performance URL1108	X X PUNCT NOUN ADP PRON ADJ NOUN X
RT @USER1713 : I find this hilarious in its appalling-ness for a number of reasons . URL1358	X X PUNCT PRON VERB PRON ADJ ADP DET NOUN ADP DET NOUN ADP NOUN PUNCT X
RT @USER1527 : Very hot ! URL423	X X PUNCT ADJ ADJ PUNCT X
RT @USER959 : #NewportNews #Virginia boy leaves Gatorade , water for #LetterCarrier URL938 via @USER6 URL224 \u2026	X X PUNCT NOUN NOUN NOUN VERB NOUN PUNCT NOUN ADP NOUN NOUN ADP X X PUNCT
The old niggas on Dr Dre album Lowkey be taking hella shots at the new niggas lol	DET ADJ NOUN ADP PROPN NOUN NOUN NOUN AUX VERB ADV NOUN ADP DET ADJ NOUN INTJ
RT @USER1874 : hi a lil reminder that u guys will meet dan & phil :~) URL1169	X X PUNCT INTJ DET ADJ NOUN SCONJ PRON NOUN AUX VERB NOUN CCONJ X X X
Egyptian writer Ahmed Naji \u2019s crime is n't what he wrote \u2013 it is that he is alive URL607	PROPN PROPN NOUN NOUN PART NOUN AUX PART PRON PRON VERB PUNCT PRON AUX SCONJ PRON AUX ADJ X
RT @USER919 : Great setting for @USER1033 Falmouth GP of the Sea 2017 URL461	X X PUNCT ADJ NOUN ADP NOUN NOUN X ADP DET NOUN NUM X
RT @USER1916 : hate getting flashbacks from things you do n't want to remember . it feels like your heart suddenly drops and anxiety starts \u2026	X X PUNCT VERB VERB NOUN ADP NOUN PRON AUX PART VERB PART VERB PUNCT PRON VERB ADP PRON NOUN NOUN NOUN CCONJ NOUN VERB PUNCT
RT @USER1256 : \ We need some payday lending reforms . \ - Alabama Banking Department Superintendent John Harrison URL1181 \u2026	X X PUNCT PUNCT PRON VERB DET NOUN NOUN NOUN PUNCT PUNCT PUNCT X X X X PROPN X X PUNCT
RT @USER2347 : For the highest ticket prices in world football , we 're ' entitled ' to expect more than zero PL / CL titles in 12 yrs . URL219 \u2026	X X PUNCT ADP DET NOUN NOUN NOUN ADP NOUN NOUN PUNCT PRON AUX PUNCT NOUN PUNCT PART VERB ADJ ADP NUM NOUN PUNCT NOUN NOUN ADP NUM NOUN PUNCT X PUNCT
Now playing on OSN Radio ( @USER2325 ) Another Day ( Perfecto Mix ) by Skip Raiders #OSN #NowPlaying ( URL1112 )	ADV VERB ADP NOUN NOUN PUNCT NOUN PUNCT DET NOUN PUNCT NOUN NOUN PUNCT ADP PROPN X X X PUNCT X PUNCT
@USER2322 what	VERB PRON
Of course , as everyone knows Powers resigned from the campaign and retracted these comments . But now she 's US Ambassador to the UN .	ADP ADV PUNCT SCONJ PRON VERB NOUN NOUN ADP DET NOUN CCONJ NOUN DET NOUN PUNCT CCONJ ADV PRON AUX PROPN NOUN ADP DET NOUN PUNCT
ugh I 'm so picky when it comes to dress shopping :(	INTJ PRON AUX ADV NOUN ADV PRON VERB PART VERB NOUN SYM
the video had an effect on me	DET NOUN VERB DET NOUN ADP PRON
Oh , and regex by @USER1783 . Do check out the slides . #NICAR16	INTJ PUNCT CCONJ NOUN ADP NOUN PUNCT AUX VERB ADP DET NOUN PUNCT X
can hou shut up beacause yiur beeath stinka URL1440	AUX VERB VERB ADP NOUN X X X X
I just do n't understand how someone can change their mind so fast . You 're so disgusting	PRON ADV AUX PART VERB ADV PRON AUX VERB PRON NOUN ADV ADJ PUNCT PRON AUX ADV X
Genocide in #Yemen yet world silence . Very strange : for US & #Europe , Yemen does n't exist ! Can You explain ? #ForgottenWarInYemen	NOUN ADP NOUN ADV NOUN NOUN PUNCT ADJ NOUN PUNCT ADP PROPN CCONJ NOUN PUNCT NOUN AUX PART VERB PUNCT AUX PRON VERB PUNCT X
Jason Jordan just threw a dude	PROPN PROPN ADV VERB DET NOUN
If you cheat on someone that is willing to do anything for you , you actually cheated yourself out of true loyalty .	SCONJ PRON VERB ADP PRON PRON AUX NOUN PART VERB PRON ADP PRON PUNCT PRON ADV VERB PRON ADP ADP ADJ NOUN PUNCT
RT @USER1289 : FRIENDLY REMINDER THAT STILES STILINSKI AND ALLISON ARGENT DESERVED MORE SCENES TOGETHER URL905	X X PUNCT ADJ NOUN PRON NOUN NOUN CCONJ NOUN X X ADV NOUN X X
.... and guess who are paying the shortfall ! URL875	PUNCT CCONJ INTJ PRON AUX VERB DET NOUN PUNCT X
RT @USER849 : TWITTER TEAM DOING PABEBE WAVE with @USER2199 STANDEE #VoteMaineFPP #KCA URL651	X X PUNCT X X X X X ADP PROPN X X X X
She wrote on a note attached \ I do nt put my credit card info on the internet \ \ud83d\ude2d\ud83d\ude02\ud83d\ude2d\ud83d\ude02 I love her old ass man .	PRON VERB ADP DET NOUN NOUN PUNCT PRON AUX PART VERB PRON NOUN NOUN NOUN ADP DET NOUN PUNCT X PRON VERB PRON ADJ NOUN NOUN PUNCT
RT @USER804 : not moving no nigga in my house , if ima do bad , ima do bad by my damn self !!! \ud83d\udc4f\ud83c\udffe	X X PUNCT PART VERB DET NOUN ADP PRON NOUN PUNCT SCONJ VERB VERB ADJ PUNCT VERB VERB ADJ ADP PRON ADJ NOUN PUNCT X
RT @USER1550 : \u201c Current mood and most of the days mood . \u201c URL695	X X PUNCT PUNCT NOUN NOUN CCONJ ADJ ADP DET NOUN NOUN PUNCT PUNCT X
RT @USER548 : As far as I 'm aware , the doors are open . And we 're On The Road Again .	X X PUNCT ADV ADV SCONJ PRON AUX NOUN PUNCT DET NOUN AUX ADJ PUNCT CCONJ PRON AUX ADP DET NOUN NOUN PUNCT
@USER1359 what about a drink of liquid nitrogen ?	VERB PRON ADP DET NOUN ADP NOUN NOUN PUNCT
RT @USER573 : Angela Eagle : I went to Uni thanks to a Labour Govt Govt when Angela Eagle went to Uni : Thatcher ( Graduated in 1983 , St \u2026	X X PUNCT X X PUNCT PRON VERB PART NOUN NOUN ADP DET NOUN NOUN X ADV NOUN NOUN VERB ADP NOUN PUNCT NOUN PUNCT NOUN ADP NOUN PUNCT PROPN PUNCT
Sames URL1428	NOUN NOUN
RT @USER399 : .. rabbits in there . Told me they were mine to love and care for . Even hired this guy to help me feed em and clean the pen . Be \u2026	X X PUNCT PUNCT NOUN ADP ADV PUNCT VERB PRON PRON AUX PRON ADP NOUN CCONJ NOUN ADP PUNCT ADV VERB DET NOUN PART VERB PRON VERB PRON CCONJ ADJ DET NOUN PUNCT AUX PUNCT
@USER2275 Careful with that porcelain skin . sweetie !	NOUN NOUN ADP DET NOUN NOUN PUNCT NOUN PUNCT
RT @USER474 : Character progression through all 10 seasons of Friends ... URL378	X X PUNCT NOUN VERB ADP DET NUM NOUN ADP NOUN PUNCT X
RT @USER905 : rt if you grew up on these streets URL1061	X X PUNCT VERB SCONJ PRON VERB ADP ADP DET NOUN X
RT @USER213 : Funding legal services focus of AG \u2019s pre-election debate URL513 via @USER2151	X X PUNCT X X X VERB ADP NOUN PART NOUN X X ADP X
RT @USER1172 : I agree with and support President Putin ! He 's right . URL1329	X X PUNCT PRON VERB ADP CCONJ NOUN PROPN NOUN PUNCT PRON AUX ADV PUNCT X
RT @USER689 : This is perhaps the most succinct and accurate sentence regarding Trumps ' popularity I have ever read . URL1157 \u2026	X X PUNCT PRON AUX VERB DET ADJ NOUN CCONJ ADJ NOUN X X PUNCT X PRON VERB ADV VERB PUNCT X PUNCT
See you again #TSOUAwkward	VERB PRON ADV X
RT @USER480 : I got a new one for you guys URL719	X X PUNCT PRON VERB DET ADJ NOUN ADP PRON NOUN X
#VOZEMPIRE : Ready to Divorce ? David Beckham Resigned From Victoria \u2019s Fashion Company URL360	NOUN PUNCT NOUN ADP NOUN PUNCT PROPN PROPN NOUN ADP NOUN PART NOUN NOUN X
If you can meditate , then you can achieve your smallest desires in life as meditation helps you shed light on every little information !	SCONJ PRON AUX VERB PUNCT ADV PRON AUX VERB PRON NOUN NOUN ADP NOUN ADP NOUN VERB PRON VERB NOUN ADP DET ADJ NOUN PUNCT
RT @USER286 : Early Bird tickets are now Sold Out !! Get your #CountryFlo passes while supplies last : URL453 URL220 \u2026	X X PUNCT ADJ PROPN NOUN AUX ADV ADP ADV PUNCT VERB PRON NOUN NOUN ADP NOUN NOUN PUNCT X X PUNCT
He said the shit stank	PRON VERB DET NOUN NOUN
RT @USER877 : and yes there are biblical references to the ' insignificance ' of women . BUT there 's just as many to our significance a \u2026	X X PUNCT CCONJ INTJ PRON AUX NOUN NOUN ADP DET PUNCT NOUN PUNCT ADP NOUN PUNCT CCONJ PRON AUX ADV ADP ADJ ADP PRON NOUN DET PUNCT
RT @USER650 : ALL THESE VIP PEEPS IN MY MENTIONS IT S LIT \ud83d\ude0d	X X PUNCT DET PRON PROPN NOUN ADP PRON NOUN PRON AUX X SYM
RT @USER1312 : we startin to bark viciously	X X PUNCT PRON VERB ADP NOUN X
RT @USER515 : \ It does n't matter how much you have . It all means nothing if you are not happy with yourself . \ Donald Duck #quotes htt \u2026	X X PUNCT PUNCT PRON AUX PART VERB ADV ADV PRON VERB PUNCT PRON DET VERB PRON SCONJ PRON AUX PART ADJ ADP PRON PUNCT PUNCT PROPN X X X PUNCT
pursuing the opposite : complain against EU red tape --> Seek EXCEPTIONAL treatment --> Get ever more red tape @USER2384 URL417	VERB DET NOUN PUNCT VERB ADP PROPN ADJ NOUN SYM X X X SYM VERB ADV ADV ADJ NOUN X X
. @USER217 explains why Lincoln 's way is the future of luxury motoring : URL1102 URL299	PUNCT PROPN PROPN ADV PROPN PART NOUN AUX DET NOUN ADP NOUN X PUNCT X X
RT @USER19 : They 're getting 1 k RTs per minute ... Start spamming if you do n't want their lead to increase . #Harmonizers #iHeartAwards \u2026	X X PUNCT PRON AUX VERB NUM NUM NOUN X X PUNCT VERB NOUN SCONJ PRON AUX PART VERB PRON VERB PART VERB PUNCT ADJ X PUNCT
Jewellery belonging to the Duchess of Windsor was auctioned today in 1987 in Geneva , raising \u00a3 31 M for medical research .	PROPN NOUN ADP DET NOUN ADP NOUN AUX ADJ NOUN ADP NOUN ADP NOUN PUNCT NOUN SYM NUM PROPN ADP ADJ NOUN PUNCT
Middle - Eastern relationships will go through the roof URL994	PROPN PUNCT NOUN NOUN AUX VERB ADP DET NOUN X
RT @USER2192 : 11 Selfies that will make you uncomfortable . URL1273 URL1530	X X PUNCT NUM NOUN PRON AUX VERB PRON NOUN PUNCT X X
#porn More free @ URL1029 No Tricks ! #gayporn #gaygif #chaturbate #gayvideo URL1477	NOUN ADJ ADJ ADP NOUN DET NOUN PUNCT X X X X X
I liked a @USER1490 video URL986 LIQUID LIPSTICKS YOU NEED !!!	PRON VERB DET PROPN NOUN X X X PRON NOUN PUNCT
Disastorus first innigs SL performed very well 2nd innings lead by 33 runs 3 wickets left for SL #ENGvSL	NOUN ADV NOUN NOUN NOUN ADV ADV ADJ NOUN VERB ADP NOUN ADP NUM NOUN VERB ADP NOUN X
@USER2482 exactly , just go ahead !!!	PROPN ADV PUNCT ADV VERB ADV PUNCT
#NowPlaying Meathook Seed URL910	X X X X
RT @USER132 : JDR did n't really address Mario Edwards being cleared ... he 's excited that Mario is part of team on the field .	X X PUNCT NOUN AUX PART ADV NOUN NOUN NOUN AUX NOUN PUNCT PRON AUX VERB DET NOUN AUX NOUN ADP NOUN ADP DET NOUN PUNCT
RT @USER2186 : chill date ideas URL419	X X PUNCT VERB NOUN NOUN X
\ Sorry I ca n't work on July 9th because everyone is leaving Hamilton & I 'm emotionally invested in their existence . \	PUNCT INTJ PRON AUX PART VERB ADP PROPN NOUN SCONJ PRON AUX VERB PROPN CCONJ PRON AUX VERB VERB ADP PRON NOUN PUNCT PUNCT
Listen to 4 - Ayo Remix Rough by Yung 4 ( fooeee ) #np on #SoundCloud URL568	VERB ADP NUM PUNCT NOUN NOUN NOUN ADP NOUN NUM PUNCT NOUN PUNCT X ADP PROPN X
RT @USER0 : YOU ARE A WITCH ! Mariah Carey 's Brother Calls Her Out For Not Helping With Dying Sister 's URL1410 URL217 \u2026	X X PUNCT PRON AUX DET NOUN PUNCT X X PART NOUN VERB PRON ADP ADP PART NOUN ADP NOUN NOUN PART NOUN X PUNCT
RT @USER2035 : JaDine Day . DNP 's First Day Gross . This Time 's First Day Gross 15 . 15M . 15M . All with 15 \ud83d\udc9c Ang saya ulitin . \ud83d\ude39 #ThisTi \u2026	X X PUNCT NOUN NOUN PUNCT X PART ADJ NOUN NOUN PUNCT DET NOUN PART ADJ NOUN NOUN NUM PUNCT NOUN PUNCT NOUN PUNCT DET ADP NUM PROPN NOUN X X PUNCT X X PUNCT
RT @USER1377 : Can we give respectability to those who want to break India ? Arun Jaitley in Rajya Sabha #AfzalDebate URL595	X X PUNCT AUX PRON VERB NOUN ADP PRON PRON VERB PART NOUN PROPN PUNCT X X ADP NOUN X X X
RT @USER785 : Hi from us @USER1759 ( excuse the insta spam ) URL980	X X PUNCT INTJ ADP PRON NOUN PUNCT VERB DET NOUN NOUN PUNCT X
RT @USER1979 : Go on URL1144 and comment a \u2764\ufe0f on any photo so I know it 's you !! URL235	X X PUNCT VERB ADP NOUN CCONJ VERB DET NOUN ADP DET NOUN ADV PRON VERB PRON AUX PRON PUNCT X
Money on my mind .. Money on my mind , so money is all I think of .	NOUN ADP PRON NOUN PUNCT NOUN ADP PRON NOUN PUNCT ADV NOUN AUX DET PRON VERB ADP PUNCT
Rattled Bangladesh run into resurgent India #IndiavsBangladesh ... #IndiavsBangladesh URL1115	NOUN NOUN VERB ADP NOUN PROPN NOUN PUNCT X X
@USER762 always here :)	NOUN ADV ADV SYM
Although your friendly nature usually puts others at ease , muc ... More for Libra URL430	SCONJ PRON NOUN NOUN NOUN VERB NOUN ADP NOUN PUNCT NOUN PUNCT ADJ ADP NOUN X
RT @USER607 : found some tires URL1025	X X PUNCT VERB DET NOUN X
if they announce dates here i will record myself bawling for your entertainment	SCONJ PRON VERB NOUN ADV PRON AUX VERB PRON VERB ADP PRON NOUN
#Mention Brett McDanel Art @USER2221 #bizitalk #uniqueart URL1345 #business	NOUN NOUN NOUN NOUN NOUN X X X X
RT @USER1910 : @USER1910 get off @USER1352 URL1376	X X PUNCT NOUN VERB ADP NOUN X
#group sex party porn anal dating URL1068	ADJ NOUN NOUN NOUN X ADV X
\ud83d\udd1e on the 13th \ud83d\ude34	NOUN ADP DET NOUN X
RT @USER1104 : Directors and CEOs from top Multinational companies meeting in a conference held at Gurugram . ( 2016 ) URL369 \u2026	X X PUNCT NOUN CCONJ VERB ADP NOUN NOUN NOUN NOUN ADP DET NOUN NOUN ADP NOUN PUNCT PUNCT NUM PUNCT X PUNCT
Do n't just be , make a difference	AUX PART ADV AUX PUNCT VERB DET NOUN
Broken Vows by English Artist Philip Calderon . Nice Canvas Art Print . Size 11 x 14 URL639 URL1110	NOUN NOUN ADP ADJ NOUN NOUN NOUN PUNCT ADJ NOUN NOUN NOUN PUNCT NOUN NUM SYM NUM X X
RT @USER1457 : Where URL978	X X PUNCT ADV NOUN
@USER1273 @USER215 be thankful it 's only 1 k ... Double or triple that for LA .	PROPN NOUN AUX VERB PRON AUX ADJ NUM NOUN PUNCT NOUN CCONJ VERB PRON ADP PROPN PUNCT
@USER1757 Your Twitterettes are doing fine .	VERB PRON NOUN AUX VERB ADJ PUNCT
basketball bitch	NOUN NOUN
You can either sit and dwell on all the negative shit ... Or you can thank god you 're alive 'n blessed !!	PRON AUX ADV VERB CCONJ NOUN ADP DET DET ADJ NOUN PUNCT CCONJ PRON AUX VERB NOUN PRON AUX ADJ NOUN NOUN PUNCT
RT @USER26 : Dio - Rainbow In The Dark !! URL1388	X X PUNCT NOUN PUNCT NOUN ADP DET NOUN PUNCT X
RT @USER482 : 3 years ago today ... The best guard of honour EVER ! #mufc URL422	X X PUNCT NUM NOUN ADV NOUN PUNCT DET ADJ NOUN ADP NOUN NOUN PUNCT X X
RT @USER1299 : Behind the scenes . Rick and Daryl #TheWalkingDead URL359	X X PUNCT VERB DET NOUN PUNCT PROPN CCONJ NOUN X X
#NowPlaying Work by Rihanna \u266b URL603	X VERB ADP PROPN SYM X
RT @USER2107 : never want to disappoint you	X X PUNCT ADV VERB PART VERB PRON
@USER1582 @USER1801 @USER1146 is logic . She leads in Alba , would connect across generations . She can also check Nic Sturgeon	PROPN NOUN NOUN AUX NOUN PUNCT PRON VERB ADP NOUN PUNCT AUX NOUN X X PUNCT PRON AUX ADV VERB NOUN X
RT @USER207 : BTS Summer Package in Dubai : Photobook , DVD , 2 mini poster , Zipperbag , Beach ball , Tattoo stickers , Charm accessory htt \u2026	X X PUNCT NOUN NOUN NOUN ADP NOUN PUNCT NOUN PUNCT NOUN PUNCT NUM PROPN NOUN PUNCT NOUN PUNCT NOUN NOUN PUNCT PROPN NOUN PUNCT X X X PUNCT
@USER2661 @USER687 yeah . Looks like he is like Wakefield , in the US calling himself doctor when he has no right to the title .	PROPN PROPN INTJ PUNCT VERB SCONJ PRON AUX ADP NOUN PUNCT ADP DET PROPN VERB PRON NOUN ADV PRON VERB DET ADV ADP DET NOUN PUNCT
@USER931 it 's wild I promise you	VERB PRON AUX NOUN PRON VERB PRON
iOrange -E 10 ft Strongest Kevlar Fiber Lightning Cable and Retractable Lightning Cable from $ 9.99 AC @USER83 URL715	NOUN NOUN NUM VERB NOUN NOUN NOUN PROPN NOUN CCONJ NOUN NOUN NOUN ADP SYM X X X X
RT @USER338 : \ You 're all racists ! \ \ Actually , I just prefer democracy to a remote , self - serving ... \ \ Shut up ! Shut up ! Racist ! \ Etc.	X X PUNCT PUNCT PRON AUX DET NOUN PUNCT PUNCT PUNCT ADV PUNCT PRON ADV VERB NOUN ADP DET NOUN PUNCT NOUN PUNCT NOUN PUNCT PUNCT PUNCT VERB ADP PUNCT VERB ADP PUNCT NOUN PUNCT PUNCT X
RT @USER598 : Bryson Tiller had a 1 hell of a year	X X PUNCT NOUN NOUN VERB DET NUM NOUN ADP DET NOUN
RT @USER1766 : A fan account 's love of you is quantifiable by the amount of reblogged ugly pictures they think you look good in . #ThenkUA \u2026	X X PUNCT DET NOUN NOUN PART NOUN ADP PRON AUX NOUN ADP DET NOUN ADP NOUN ADJ NOUN PRON VERB PRON VERB ADJ ADP PUNCT X PUNCT
@USER1830 Now there 's a quote	NOUN ADV PRON AUX DET NOUN
